post_id,user_id,timestamp,content,content_length
743a4252-cb85-44bb-b555-28087d344ce4,3993d595-afc1-479a-aae8-ca4b3698b7e5,2026-01-28 18:31:25.122948,Drop national federal wall accept key smile necessary.,8.0
0a267fd8-950f-4904-a622-57672a67ada6,3993d595-afc1-479a-aae8-ca4b3698b7e5,2026-01-30 14:46:07.123948,Worker amount would interview success sister six wonder nation continue ever plan ready.,13.0
522ae280-e1d4-4a57-9721-606ce5449fc0,3993d595-afc1-479a-aae8-ca4b3698b7e5,2026-02-19 23:17:32.123948,Order from strategy according mind way decade cause work its third.,11.0
4d92b6b5-c476-424b-a7a7-b1b6afd278d6,99484118-5649-453d-81ac-ba4da2c6674c,2026-02-07 21:49:03.123948,Put with moment almost onto us religious pass whose.,9.0
000d1522-4419-4ba9-94bc-5dfdd5449920,99484118-5649-453d-81ac-ba4da2c6674c,2026-01-26 20:46:05.123948,Consider time home actually economy near city when tax important power help before cup plan must.,16.0
9aaca407-91b5-44c1-a06b-784b160d809b,99484118-5649-453d-81ac-ba4da2c6674c,2026-02-19 17:46:47.123948,By serve politics provide within think director central although.,9.0
6635ec7c-795f-4229-9942-39f8dbe8509e,35fab357-c44f-4725-99e9-2455bcdbf1e6,2026-01-29 13:48:43.123948,Young lose trouble sport author.,5.0
42518b61-8f7c-46b8-9949-c54a5502ef0e,35fab357-c44f-4725-99e9-2455bcdbf1e6,2026-02-03 16:52:37.123948,Suggest end east because job stock.,6.0
7cf02d78-d8ae-457e-b805-34d55cd209fd,35fab357-c44f-4725-99e9-2455bcdbf1e6,2026-02-13 21:06:23.123948,Ground paper form business position stuff board deal themselves.,9.0
67e5b98b-53c3-417e-ac28-9cffd3e23062,35fab357-c44f-4725-99e9-2455bcdbf1e6,2026-02-14 16:32:30.123948,You finally series education himself listen guess.,7.0
a003a364-1ad3-4dcd-a3a3-e70194243aff,35fab357-c44f-4725-99e9-2455bcdbf1e6,2026-02-21 19:34:26.123948,Will pass wind church establish talk by none student.,9.0
30643775-801e-41a1-9466-a896be3d6a92,28b97b84-34f6-4de1-a3fe-2396ff960c1b,2026-01-31 20:31:11.123948,Lot could here occur network we help.,7.0
4244902e-95d1-4953-a85f-e5af101d1295,28b97b84-34f6-4de1-a3fe-2396ff960c1b,2026-02-12 20:08:55.123948,Politics citizen what stock must operation while unit.,8.0
5b945522-6fe3-4956-93b0-039b1269cb16,28b97b84-34f6-4de1-a3fe-2396ff960c1b,2026-01-25 23:38:00.123948,Across effort specific ever watch follow summer.,7.0
007c8279-f74c-45a8-9e40-cc7a7d980ae0,80951d7a-e3fc-4788-8948-fcbf3a830c24,2026-02-03 15:40:32.123948,Information game writer respond she college different participant law.,9.0
ca3b52ca-72c7-41fb-a040-4cb54dc775c1,80951d7a-e3fc-4788-8948-fcbf3a830c24,2026-02-10 15:03:41.123948,About its too clear must blood degree.,7.0
47bf6681-ecb0-458a-8fb4-f24939f5edfd,80951d7a-e3fc-4788-8948-fcbf3a830c24,2026-02-03 19:08:43.123948,College ago model memory author respond those among region.,9.0
af0d31fe-bf98-4d2f-b6c2-6104e1eaa344,80951d7a-e3fc-4788-8948-fcbf3a830c24,2026-02-04 19:48:05.123948,Nor everyone responsibility site them toward.,6.0
9fbe750a-06a4-4485-b953-19e28a013682,80951d7a-e3fc-4788-8948-fcbf3a830c24,2026-01-24 18:05:59.123948,Base medical full defense may common believe.,7.0
a550dd73-8832-42aa-b764-742138d5fcc3,80951d7a-e3fc-4788-8948-fcbf3a830c24,2026-02-22 23:57:16.123948,International brother wife news last late make rich speech your deep doctor six fight.,14.0
1635b210-2706-42cd-b664-2828004f1b54,80951d7a-e3fc-4788-8948-fcbf3a830c24,2026-02-22 21:50:53.123948,Music girl positive right old note father red everyone while suddenly manage.,12.0
5f2f462b-4cc3-49f6-888d-42206b61c992,3fdfd665-6792-48ed-a6c9-73869670546d,2026-02-11 16:52:58.123948,Wish whatever short push sense energy card group.,8.0
6fbd9fd3-8d9f-4f6a-b484-17e53f12f115,3fdfd665-6792-48ed-a6c9-73869670546d,2026-02-19 23:53:50.123948,Born person should else have science.,6.0
0c041d9e-5c6c-4e9d-bef4-bd8f4a96e6d4,3fdfd665-6792-48ed-a6c9-73869670546d,2026-02-04 19:33:38.123948,Painting stand pressure meet down decide clearly choose action his have do look.,13.0
5edf322c-1aec-492a-9998-3c5a424aacbf,3fdfd665-6792-48ed-a6c9-73869670546d,2026-02-06 15:28:55.123948,Quality late travel gas entire day computer owner likely.,9.0
b5bea5e2-017d-40ee-9f22-062e93152f82,3fdfd665-6792-48ed-a6c9-73869670546d,2026-02-05 16:34:24.123948,Responsibility every happen often past development participant food floor movement message two.,12.0
6c5f1f15-7243-469b-a0ad-1e0b10589df0,3fdfd665-6792-48ed-a6c9-73869670546d,2026-02-18 18:42:10.123948,Bed paper pull market above network about church laugh evening according.,11.0
1ededbf0-c91c-4521-a68b-d81d0897791d,536b5efc-98fb-4988-beb0-f643d884eac8,2026-02-21 16:53:37.123948,Data pretty team anything into business other.,7.0
dc334d8c-080e-42cb-9839-3b37dabe70f4,536b5efc-98fb-4988-beb0-f643d884eac8,2026-02-12 23:33:21.123948,School east yourself above account get century boy deal great run herself detail.,13.0
0569cd58-68c2-43ca-8792-bdc94aac1ffd,536b5efc-98fb-4988-beb0-f643d884eac8,2026-02-22 16:46:12.123948,Question back budget court suggest election customer soldier account.,9.0
9b47f070-f098-4464-8518-1b05aefa70bb,536b5efc-98fb-4988-beb0-f643d884eac8,2026-02-09 18:42:51.123948,Idea security can how test.,5.0
32997968-3b5d-40f2-a247-27662a258377,536b5efc-98fb-4988-beb0-f643d884eac8,2026-01-31 17:53:25.123948,Old size according lay third activity media.,7.0
469690b3-7cda-443e-ba19-423b669697fb,bc3dba6a-1d4b-441b-ab8d-852558a65b80,2026-02-20 20:46:04.123948,Radio to office history first student as.,7.0
f33669cf-dad5-48ea-8c4b-b4fde5f42c14,bc3dba6a-1d4b-441b-ab8d-852558a65b80,2026-02-04 19:08:16.123948,Skin laugh mean explain available.,5.0
e3444183-fd80-4e7d-9cf5-4ecc775e999d,bc3dba6a-1d4b-441b-ab8d-852558a65b80,2026-02-19 22:17:48.123948,Bill reach instead back something instead mouth smile.,8.0
22f6bec7-b9c9-49d9-8e4a-8b6817c5c034,bc3dba6a-1d4b-441b-ab8d-852558a65b80,2026-02-16 19:45:15.123948,Lead theory foot want east still charge plant three all.,10.0
94c5a9c4-1d6f-4872-85b2-032345694960,bc3dba6a-1d4b-441b-ab8d-852558a65b80,2026-02-16 17:22:11.123948,Responsibility four ago animal coach case these produce to particularly they own past data deal meeting.,16.0
0752d608-7fd1-4dad-ac6b-8da439365f40,bc3dba6a-1d4b-441b-ab8d-852558a65b80,2026-02-05 23:18:15.123948,Plant place focus detail.,4.0
8d5b4704-c235-4498-87b6-e16f5b4aabfe,bc3dba6a-1d4b-441b-ab8d-852558a65b80,2026-02-08 18:35:55.123948,Drug letter song thing model language who plan star area view.,11.0
775ca417-2e1d-4f1a-abcd-9468f9b2bcb5,bc3dba6a-1d4b-441b-ab8d-852558a65b80,2026-02-08 21:05:16.123948,They heavy rule go government interest young police view leg especially.,11.0
559d4f84-41bd-4e83-93df-7e62d378f0eb,65ef1a40-4c0f-4998-bb29-d8e2df511863,2026-02-02 19:21:46.123948,City represent image current true fire standard eight note.,9.0
a91f4d52-bab6-4432-8da2-5469d884da56,65ef1a40-4c0f-4998-bb29-d8e2df511863,2026-02-19 21:16:22.123948,Teach like Congress senior become can single and detail accept your on within nothing only white.,16.0
c04b8495-98ab-4bd0-9e5b-22327e7864df,65ef1a40-4c0f-4998-bb29-d8e2df511863,2026-02-21 13:27:55.123948,Stage moment nice small special race.,6.0
3cfda215-3c3c-46c5-bf19-2d796d94ff74,f722a30e-3f80-41b6-b78d-f77a399ca827,2026-01-27 23:12:35.123948,Rise anything hard these doctor.,5.0
255bafa0-85a5-4cce-a59c-bbd0de7f80c0,f722a30e-3f80-41b6-b78d-f77a399ca827,2026-01-28 18:44:31.123948,Think wear what company statement after visit business box not since firm father bill cost.,15.0
2e545ac9-2049-46db-aa26-75779f53a6ca,f722a30e-3f80-41b6-b78d-f77a399ca827,2026-02-15 21:02:52.123948,Finally but send course even.,5.0
329eec71-9f7f-4adf-a565-2acfccb2850e,f722a30e-3f80-41b6-b78d-f77a399ca827,2026-02-12 22:27:25.123948,Might article tough positive miss base treatment off little.,9.0
c41872a5-ddc2-4d8d-b5e4-e39436568dc3,f722a30e-3f80-41b6-b78d-f77a399ca827,2026-02-13 13:19:18.123948,Hundred determine fast security kitchen west sense cover local pretty hundred bank born whole.,14.0
b3c4d40a-9886-4a14-83c1-28e83215fff3,f722a30e-3f80-41b6-b78d-f77a399ca827,2026-02-07 21:18:08.123948,Particularly direction onto they across author government my great glass teacher also.,12.0
a233d81a-2cc9-48ef-92e2-64e66801e8cd,f722a30e-3f80-41b6-b78d-f77a399ca827,2026-01-26 21:04:00.123948,Everybody president win room teacher question join movement each.,9.0
d2e619d7-b5b3-496b-99b6-a3261a475bbf,f722a30e-3f80-41b6-b78d-f77a399ca827,2026-02-07 18:35:54.123948,Election throw however I.,4.0
5d68eed1-fac1-4b1e-b80e-cd7b6567b566,1ed50fab-151d-4ec7-a5a3-4cd35da31ebb,2026-02-17 16:02:26.123948,Concern together manager kid hospital rate under hair foreign.,9.0
7a91a2b0-4f74-4042-b9f3-79ab8e5f1353,1ed50fab-151d-4ec7-a5a3-4cd35da31ebb,2026-02-11 20:00:41.123948,Take mouth surface drug body their today.,7.0
e2f917fc-1ce1-4718-a5f9-baa41de22ae9,1ed50fab-151d-4ec7-a5a3-4cd35da31ebb,2026-02-14 22:32:54.123948,Beyond may easy enough eight beautiful every method fund recent drive.,11.0
0d8eb1a3-df2a-4af4-95e8-62d9d179c194,1ed50fab-151d-4ec7-a5a3-4cd35da31ebb,2026-02-10 11:21:27.123948,Current value discussion red figure south message treat full year list defense marriage science year result challenge rise.,18.0
b88c57c7-7ace-44e2-a7cc-1645e6e8779c,7634d126-659a-4c14-835d-65503461d3fd,2026-02-01 15:28:50.123948,Building north benefit leave many director provide catch create go.,10.0
67982c87-7998-4092-be14-6baea8578aed,7634d126-659a-4c14-835d-65503461d3fd,2026-02-17 22:05:18.123948,Relate participant reality.,3.0
b465d8e3-087d-4409-91d0-ae0e60cb168d,7634d126-659a-4c14-835d-65503461d3fd,2026-02-03 21:39:16.123948,Statement item strong beyond least simple concern election create mean see sing end piece human all.,16.0
80409323-20f0-4b25-b6b4-600a1e13afee,7634d126-659a-4c14-835d-65503461d3fd,2026-01-26 22:33:12.123948,Pass medical rock defense son above themselves hospital some.,9.0
2cd25db5-5209-46fb-92ab-8a1b187d17a1,7634d126-659a-4c14-835d-65503461d3fd,2026-02-09 20:13:55.123948,Claim realize election social growth structure stay public wonder according front.,11.0
78fe3117-2242-4dfb-b4f2-699c99afbc79,7634d126-659a-4c14-835d-65503461d3fd,2026-01-27 15:58:14.123948,Her executive reveal street oil indeed as herself.,8.0
c6a292fb-90a9-44ce-b369-2f728b8746de,7634d126-659a-4c14-835d-65503461d3fd,2026-02-14 19:14:39.123948,Wife investment land specific bit left stock bad from law issue deal whether about.,14.0
7c5f5425-51f4-48e1-8712-6f00200122ef,9bd9186f-5627-4081-9afa-87f77f85c760,2026-02-21 18:14:01.123948,Land resource region community eat own outside cell seek.,9.0
305812f9-7b90-4f26-96d7-fcac702f48c6,9bd9186f-5627-4081-9afa-87f77f85c760,2026-02-03 17:27:11.123948,World bit environmental opportunity field could rich stock meeting accept father decide man condition.,14.0
a1d1a8dd-0d7c-4c44-b8fb-2c4adf73d406,9bd9186f-5627-4081-9afa-87f77f85c760,2026-01-25 17:06:46.123948,Here political short state admit notice.,6.0
80c39414-c602-4ffb-b046-7f67cb803b11,9bd9186f-5627-4081-9afa-87f77f85c760,2026-01-25 20:09:45.123948,Require light no must article should recently through heavy Mr hundred practice white there run wonder goal less.,18.0
d8f60351-ebe4-4268-ae34-ad12c966424c,a2586084-ccac-449a-9c23-b46401807007,2026-02-12 18:39:22.123948,Else computer share allow so partner common radio can rich.,10.0
04f71894-1aba-4175-a346-ad5b1f75efd7,a2586084-ccac-449a-9c23-b46401807007,2026-02-20 18:26:16.123948,Service wait call oil pattern.,5.0
ce63363a-fe97-43bf-8b0c-c65329ea5fd6,a2586084-ccac-449a-9c23-b46401807007,2026-02-07 16:53:42.123948,Again career everything chance turn air against necessary create.,9.0
6377751b-422e-4d25-996e-9defc0a586a5,a2586084-ccac-449a-9c23-b46401807007,2026-02-13 19:45:54.123948,Send list agreement also animal board charge.,7.0
f9ffe30f-0f42-475b-9ebc-fb14ff9cf307,a2586084-ccac-449a-9c23-b46401807007,2026-02-23 23:50:44.123948,Really nearly language water alone few clear television.,8.0
6a07af3b-ec1b-43db-a0b9-344ce3bc0cd3,a2586084-ccac-449a-9c23-b46401807007,2026-02-09 23:05:08.123948,White less nearly upon over investment him dinner home commercial author condition talk from result like.,16.0
7a22951e-a03e-4fb0-9246-2bd95c31364b,a2586084-ccac-449a-9c23-b46401807007,2026-02-11 11:42:22.123948,Tonight return prevent fill number sometimes.,6.0
b671d747-eb11-442f-874b-c7fafabd70fe,a2586084-ccac-449a-9c23-b46401807007,2026-02-03 21:55:57.123948,Time doctor organization break cover onto physical.,7.0
badbb051-41bb-466d-b8c6-19b7ac136030,25a3a186-e471-4d64-8468-406d79f6f179,2026-02-12 15:22:35.123948,Year explain seek tree great six same draw player stock father defense pass.,13.0
b73d8424-d873-41fa-89a7-e7a51d87b286,25a3a186-e471-4d64-8468-406d79f6f179,2026-01-26 15:13:39.124947,Pick low whole finally speak certainly want skill quite management someone face force interview.,14.0
07df8ce5-7ea6-42e1-89b1-8aee4deec1ba,25a3a186-e471-4d64-8468-406d79f6f179,2026-01-25 23:47:40.124947,Form tax create American this election government partner.,8.0
4f40da4b-920e-43a2-b7cc-79c3fe777267,cab46202-fa6d-490a-8b58-f2376b49b847,2026-02-22 17:00:57.124947,Best you heavy move explain cell I situation road.,9.0
bf22eb9b-9ea3-4953-8a74-c8c25bc1110a,cab46202-fa6d-490a-8b58-f2376b49b847,2026-02-01 19:26:59.124947,World hotel a with fact home list cover food.,9.0
08e01ee1-61b2-4006-a647-90ce19d97f67,cab46202-fa6d-490a-8b58-f2376b49b847,2026-02-04 16:38:42.124947,Little soldier family rich husband lot health baby successful letter.,10.0
83351457-73cf-4336-a530-6e5907ab352e,cab46202-fa6d-490a-8b58-f2376b49b847,2026-02-20 20:22:15.124947,Another support another letter father eye realize above recently event nice discuss billion general.,14.0
068d4a6b-3183-4aa4-95a5-7306179c0c9d,cab46202-fa6d-490a-8b58-f2376b49b847,2026-02-15 15:40:06.124947,Step according serious number along market.,6.0
dcc70e5a-a234-43ee-95ff-321425f02273,cab46202-fa6d-490a-8b58-f2376b49b847,2026-01-31 23:44:18.124947,Particular return security challenge myself play clearly instead responsibility deep body dinner.,12.0
69572b16-5f65-4288-8840-0783382e70ef,cab46202-fa6d-490a-8b58-f2376b49b847,2026-02-23 21:16:42.124947,Popular leg the show three water property have than truth standard effect.,12.0
46edfd02-7326-4a99-b07f-58fa02db1562,35da742b-757b-4650-9cab-b7a5c03e9ef4,2026-02-11 16:42:01.124947,Listen common much onto notice fire morning.,7.0
523f35a8-25e8-420c-a45b-9e4219b01bc7,35da742b-757b-4650-9cab-b7a5c03e9ef4,2026-02-10 15:31:31.124947,Only year watch worker bed lot remember along financial in.,10.0
5c7f9aac-671e-4436-b5f1-94766d0dac5a,35da742b-757b-4650-9cab-b7a5c03e9ef4,2026-02-19 15:14:47.124947,Collection budget painting cold.,4.0
6a2f95bb-8c3d-4f4c-a428-660e735df04b,5bb5914b-1083-4006-a4d5-0c3bb08201ab,2026-02-18 19:12:58.124947,Born cup south none within nation range.,7.0
a581be0e-0e6f-4650-a7dc-b154fc8a27f5,5bb5914b-1083-4006-a4d5-0c3bb08201ab,2026-02-14 14:30:42.124947,Green own force coach same education.,6.0
72e76485-08bd-4db6-bf8f-6cadad4ec260,5bb5914b-1083-4006-a4d5-0c3bb08201ab,2026-02-01 21:37:16.124947,Common prepare blue personal.,4.0
a85c8775-1557-418f-8501-46c7320e191f,5bb5914b-1083-4006-a4d5-0c3bb08201ab,2026-02-10 19:52:49.124947,Investment region deal appear world might game.,7.0
48f97b94-05cb-4245-b964-bfd8889dc57d,5bb5914b-1083-4006-a4d5-0c3bb08201ab,2026-02-09 22:57:20.124947,Heavy generation indeed mind ready side raise happy hospital.,9.0
53f163b8-c0f6-426f-b504-cef9679fd48d,4e7e3794-9089-408b-ba69-ca8687392f03,2026-01-28 22:03:01.124947,Hair want arrive city possible money page brother election Republican six most kitchen us need.,15.0
3e987501-69ae-4993-852e-f64f52207d24,4e7e3794-9089-408b-ba69-ca8687392f03,2026-02-21 19:49:11.124947,Positive bed down vote run someone anything everyone station region.,10.0
30fc4ed0-e552-4d18-a977-9cc09fe473c4,4e7e3794-9089-408b-ba69-ca8687392f03,2026-01-30 21:10:33.124947,Member those rich free responsibility energy win task.,8.0
48b3fd79-92f6-436a-89a1-c342841d0d29,4e7e3794-9089-408b-ba69-ca8687392f03,2026-01-28 21:07:46.124947,With beat up western water service bar message result moment success heart.,12.0
d5abd62b-3b06-4124-8717-357fc60069eb,4e7e3794-9089-408b-ba69-ca8687392f03,2026-01-31 18:30:05.124947,Attorney first him land above yourself baby society really draw sometimes.,11.0
adb747aa-be83-4b0f-9484-4561f681d304,4e7e3794-9089-408b-ba69-ca8687392f03,2026-02-05 22:10:52.124947,Mind bank management dream most baby.,6.0
fb9ebb27-be5d-4e91-b5df-b674f80f8620,4e7e3794-9089-408b-ba69-ca8687392f03,2026-01-29 21:11:13.124947,Career actually the institution among after which past lay vote since some miss leave.,14.0
5a97caf4-f46b-462e-a3d7-cd6714eeebef,4e7e3794-9089-408b-ba69-ca8687392f03,2026-02-07 17:37:18.124947,Reality health foot play statement place address money foreign firm take tonight door support today.,15.0
c3246d78-3271-4850-a457-ed8033755dbe,8dacb711-2bc7-469a-a511-4452a3c36468,2026-02-22 21:55:57.124947,Behavior small strategy another scientist only argue four recent notice shake call law set television.,15.0
0662d08f-4f4d-49a2-9e22-25370be7c9c3,8dacb711-2bc7-469a-a511-4452a3c36468,2026-02-06 19:29:19.124947,Particularly peace condition worker audience turn gas exactly foreign check power TV medical property actually entire.,16.0
690e4921-67b1-4fdf-9050-fd9724ed529b,8dacb711-2bc7-469a-a511-4452a3c36468,2026-02-09 20:43:41.124947,The west hand election their seek big build American sing tree work open.,13.0
9853f8ab-3488-46ee-b6c2-abeb8c36167b,8dacb711-2bc7-469a-a511-4452a3c36468,2026-02-12 18:24:44.124947,History policy boy story tend commercial hour space role less away miss include later past accept.,16.0
e00a6fd6-7303-495c-a9d7-764bcfbd37f4,8dacb711-2bc7-469a-a511-4452a3c36468,2026-02-09 16:45:06.124947,Into hospital world game education per baby suddenly great learn marriage religious might.,13.0
27c6f7f2-aa05-4659-bf7e-7365b83b2abf,f02a60b2-1007-48b7-ad28-d7d60bb80f92,2026-02-14 22:26:35.124947,Both hand five visit future receive leg TV election buy.,10.0
533d2787-86be-4f1d-a93d-d77bda44f53b,f02a60b2-1007-48b7-ad28-d7d60bb80f92,2026-01-28 18:51:17.124947,International million interesting official statement science while power be treat property.,11.0
b330b173-d89a-4b56-9c2f-965dfefc90e7,f02a60b2-1007-48b7-ad28-d7d60bb80f92,2026-02-14 20:01:54.124947,Answer economic serve common whose.,5.0
c76cef89-a1a6-4530-95f3-51895694435b,f02a60b2-1007-48b7-ad28-d7d60bb80f92,2026-01-28 19:55:40.124947,Prepare management large our blood air.,6.0
1f757ece-6ef0-4045-855c-d6ad361a8bd4,f02a60b2-1007-48b7-ad28-d7d60bb80f92,2026-02-11 17:26:24.124947,Box win success hot nice.,5.0
538d041d-8b9c-4816-a452-e85b1e431ff0,f7ab5889-4cc3-4d8a-9cfa-be927dfb0076,2026-02-21 18:39:41.124947,Energy whether simple third authority bit.,6.0
86a6d088-ba2b-4c91-864f-48457a0e05c6,f7ab5889-4cc3-4d8a-9cfa-be927dfb0076,2026-02-03 12:58:19.124947,Particular site street floor may turn response write despite probably use interesting hotel address.,14.0
ab937985-8420-41b9-b149-0241aff97641,f7ab5889-4cc3-4d8a-9cfa-be927dfb0076,2026-01-27 19:33:58.124947,Difficult soon listen miss material student.,6.0
5ac628c1-9789-4fcb-b057-6d27dc9e69c5,f7ab5889-4cc3-4d8a-9cfa-be927dfb0076,2026-01-29 22:53:32.124947,Performance check issue page performance foreign.,6.0
79d52c0c-bfa5-4257-aff2-0980097dce86,f7ab5889-4cc3-4d8a-9cfa-be927dfb0076,2026-02-14 19:07:05.124947,Central section friend alone young sit blue ahead data travel final agency agreement daughter air.,15.0
4b6ba092-443d-47c7-86ac-aeb7c06d352b,f7ab5889-4cc3-4d8a-9cfa-be927dfb0076,2026-02-12 21:15:00.124947,Rest oil prevent investment main hard guess message allow north explain care.,12.0
138ac044-4b92-4a87-bff1-f7a62a35fdb3,f7ab5889-4cc3-4d8a-9cfa-be927dfb0076,2026-02-10 20:40:00.124947,Pm blood benefit upon improve present say chair firm allow.,10.0
5e0e2c82-ccc0-4d3e-80e5-c9c6cac99030,f7ab5889-4cc3-4d8a-9cfa-be927dfb0076,2026-01-28 16:06:29.124947,Family language effect I speech scientist TV produce answer person director item do hear.,14.0
92573919-591f-460a-8b2b-7566d1cdffb1,ed939e01-1a5b-43fa-b401-3a72cade68db,2026-02-07 18:58:47.124947,Cover and guy the add theory sort center offer say.,10.0
ab0357bc-b7e5-415a-8acc-e5dff327fbb1,ed939e01-1a5b-43fa-b401-3a72cade68db,2026-02-01 22:56:43.124947,Generation edge exist unit degree give fast base place or kid.,11.0
be78ea2a-c30e-4930-b957-66dd90b0d771,ed939e01-1a5b-43fa-b401-3a72cade68db,2026-02-17 20:50:37.124947,Suggest avoid music rather left probably long magazine debate law himself hold tend risk.,14.0
b8bd61a7-1ddf-491f-8d3b-bcb51e89b537,ed939e01-1a5b-43fa-b401-3a72cade68db,2026-02-05 17:56:12.124947,Measure large certain sell direction type pick plant trip structure director threat.,12.0
803e7edf-0508-44ef-a8c9-7e05d8788f49,ed939e01-1a5b-43fa-b401-3a72cade68db,2026-01-24 17:06:44.124947,Bad enjoy employee first fly law.,6.0
54ecb4b8-80a4-4a81-ba04-7520b5b1bff9,7d86e3c8-7f2c-406b-9fcb-3a31edcdbb7b,2026-02-23 16:07:13.124947,After teach business he main door foot style along relationship water son really.,13.0
5787b091-544b-4f68-9cd9-3345981081c6,7d86e3c8-7f2c-406b-9fcb-3a31edcdbb7b,2026-02-12 23:54:28.124947,Business entire rise surface staff prevent.,6.0
db0cec8a-1d09-4a70-97f6-b8173038f1cf,7d86e3c8-7f2c-406b-9fcb-3a31edcdbb7b,2026-02-02 19:37:59.124947,Table measure need perhaps also at catch majority type player fly.,11.0
b288b783-6171-4812-8ee4-dff498fdc858,7d86e3c8-7f2c-406b-9fcb-3a31edcdbb7b,2026-02-13 23:33:32.124947,Real traditional contain exactly member free.,6.0
a5067cc9-dd06-433a-bbaf-7c576aa2091b,7d86e3c8-7f2c-406b-9fcb-3a31edcdbb7b,2026-02-23 19:38:06.124947,State understand region business approach feeling leader.,7.0
19da2e62-5d6f-4409-9691-09d5b5fd7eec,7d86e3c8-7f2c-406b-9fcb-3a31edcdbb7b,2026-01-31 23:13:22.124947,Guy say democratic.,3.0
5ca0bf6b-036c-4b3f-89db-4725302d5dd4,7d86e3c8-7f2c-406b-9fcb-3a31edcdbb7b,2026-02-01 16:30:07.124947,Friend would do recent word.,5.0
c8ec956b-efa4-47ee-a16c-c5efd93416a9,7d86e3c8-7f2c-406b-9fcb-3a31edcdbb7b,2026-01-25 18:02:04.124947,Necessary support step minute property believe anything know anything life nearly pass live nearly.,14.0
b0977ac9-6035-4078-a297-ac97cfbc690a,f8f1b104-b22e-4cc5-99e5-caa2ba6d77de,2026-02-04 18:13:05.124947,Story young value concern fear land affect response.,8.0
814a13a7-b6f0-41b3-bf6a-88c664ee80bc,f8f1b104-b22e-4cc5-99e5-caa2ba6d77de,2026-02-07 21:14:52.124947,Side of term think keep rule discuss start beautiful do.,10.0
ff240f23-9a08-45f6-b518-4ea94fba4c8a,f8f1b104-b22e-4cc5-99e5-caa2ba6d77de,2026-01-26 16:00:00.124947,Our teacher continue analysis sound white sometimes series.,8.0
e800f6e4-9bb0-43f0-8ee6-b2b4eef4a0be,f8f1b104-b22e-4cc5-99e5-caa2ba6d77de,2026-02-21 20:26:52.124947,Why tell common whether child mouth rest respond.,8.0
853a0047-8986-4d8c-ada2-645f4bcd8dad,f8f1b104-b22e-4cc5-99e5-caa2ba6d77de,2026-02-09 23:56:58.124947,Point human time send beautiful beautiful management worry benefit modern recognize.,11.0
88acc6e4-663d-4913-9fcc-e355c41494a5,92af7d8a-853a-4bcb-a9f5-35c9c1a6e54e,2026-01-26 23:56:04.124947,Street door two ahead eye seven human.,7.0
01279939-2c5b-46aa-8845-f002faacaad6,92af7d8a-853a-4bcb-a9f5-35c9c1a6e54e,2026-02-08 22:51:11.124947,Movie now picture plan once dog.,6.0
bc3b828c-ed5d-4fea-99b3-da247ad769a7,92af7d8a-853a-4bcb-a9f5-35c9c1a6e54e,2026-02-11 23:46:58.124947,Specific decide stand clearly unit general box huge research owner add play space.,13.0
dbe023ef-9c9f-4bc6-aa89-628aa1825ef5,92af7d8a-853a-4bcb-a9f5-35c9c1a6e54e,2026-01-30 23:49:42.124947,Teacher series carry mother direction member traditional technology since eye.,10.0
c1f21219-96c2-4621-847b-0610f3af7883,92af7d8a-853a-4bcb-a9f5-35c9c1a6e54e,2026-02-21 18:59:48.124947,Sport game cup mother send site reason alone relationship present modern.,11.0
8df78538-d23f-42d9-a34a-44f6062c26db,4ee8914a-06b5-49fc-8b26-05ff647c22de,2026-02-08 19:31:26.124947,Stock address partner various receive.,5.0
efa36206-8d21-46a2-9e3a-6f746b520a24,4ee8914a-06b5-49fc-8b26-05ff647c22de,2026-02-09 21:49:19.124947,Decision bar nature opportunity idea radio foreign quite Mrs.,9.0
6c33fba3-8379-4623-9e6d-ea0c571e340c,4ee8914a-06b5-49fc-8b26-05ff647c22de,2026-01-31 16:48:51.124947,Certain town smile capital ability teach.,6.0
c9066c16-3cab-4581-9a1c-42ca095f74ae,86b2898e-d9f5-4084-8591-4affa5c01f9a,2026-02-05 23:51:01.124947,Indicate almost account century strong seat.,6.0
42fb1811-059c-4822-89c7-242e8c1c6d94,86b2898e-d9f5-4084-8591-4affa5c01f9a,2026-01-31 16:33:46.124947,Organization hope him most impact from force drop few attack seat project look company.,14.0
3bfc3c4d-a66b-4e9b-b39a-c2f828ff63db,86b2898e-d9f5-4084-8591-4affa5c01f9a,2026-02-23 17:23:57.124947,Art seven interest partner smile success top key.,8.0
24fdf08e-78fd-4818-95c7-1e73b4250fd2,86b2898e-d9f5-4084-8591-4affa5c01f9a,2026-02-19 15:15:41.124947,When suffer idea radio believe election.,6.0
32d8fe64-7c7b-483f-adcd-ebefafad9d2b,86b2898e-d9f5-4084-8591-4affa5c01f9a,2026-02-16 20:04:15.124947,Every in peace physical water me.,6.0
7f60cf6d-a4be-4560-9d84-ea592aedc9ce,05f11be2-8dec-4c95-bd5e-73657f619c4e,2026-01-25 21:17:17.124947,Century worry apply cut condition travel daughter attack cold follow yet human instead radio sea quite hold sort type.,19.0
ed1ef99a-22cb-44aa-9223-1457dafaf52e,05f11be2-8dec-4c95-bd5e-73657f619c4e,2026-01-26 23:06:42.124947,Main place fly group behavior improve future detail health meeting paper suffer difference.,13.0
1dbd306f-5f7a-43a4-958f-fd991b86038b,05f11be2-8dec-4c95-bd5e-73657f619c4e,2026-02-16 21:49:05.124947,Describe suffer teach hit leave spring remember.,7.0
6036f6a4-534e-408d-9867-3c7d048be955,05f11be2-8dec-4c95-bd5e-73657f619c4e,2026-01-25 16:26:15.124947,Stage develop body rich religious hour something.,7.0
