post_id,user_id,timestamp,content,content_length
25260956-9b68-4647-971a-9b259c493c99,5463aeda-91a6-43d4-8adb-66b588a5ac44,2026-02-14 18:55:36.153341,Opportunity at side skin fine policy trial between lot style million talk Congress lay this parent despite major.,18.0
daf6fb98-432c-4d53-802e-2a92e3b3eb6e,5463aeda-91a6-43d4-8adb-66b588a5ac44,2026-02-15 18:44:56.153341,Usually once sister simple always wear challenge.,7.0
4ab2b7ba-04fe-4326-b606-924c140e096d,6ab29dbf-e8ea-46df-803d-35d380e693fb,2026-02-03 20:53:47.153341,Central center similar parent.,4.0
3eef7914-c55e-4e5c-bfc9-59bc1c0fab48,6ab29dbf-e8ea-46df-803d-35d380e693fb,2026-01-26 22:07:13.153341,Interest series then break write long create system.,8.0
c674e3cf-b40d-4d66-aad6-83b8bb48bec2,6ab29dbf-e8ea-46df-803d-35d380e693fb,2026-02-20 18:57:16.153341,Major sing rest deal part politics.,6.0
fb4895e7-b122-4036-acc0-0e539fc25e87,6ab29dbf-e8ea-46df-803d-35d380e693fb,2026-01-28 16:56:43.153341,Public network very time state sure choose wind street that also clearly to where mission you.,16.0
3cdeb00b-8b5b-4610-bb42-fe860c4e728a,6ab29dbf-e8ea-46df-803d-35d380e693fb,2026-02-14 20:19:31.153341,Professional rich technology security how political thus set per vote kitchen free you who.,14.0
078d49a5-b597-4e63-91c6-5e5a12bf0be0,6ab29dbf-e8ea-46df-803d-35d380e693fb,2026-02-20 13:52:14.153341,Begin thus design history under simply goal great little challenge determine for.,12.0
693bdfba-4ab5-4d58-b1a5-869d6a7be12d,e219e2bb-401d-400f-8e0d-e7415efe42dc,2026-02-18 17:18:46.153341,Big cup lead risk we security inside director off strategy our.,11.0
7340e594-dd76-451d-8b35-6e3d78f232e7,e219e2bb-401d-400f-8e0d-e7415efe42dc,2026-02-17 22:47:05.153341,Remember full bar a group rule suggest.,7.0
2462aae0-8618-4e9d-a0e9-0b764fb37184,e219e2bb-401d-400f-8e0d-e7415efe42dc,2026-02-01 16:26:21.153341,Tough magazine win out economy travel nation agree either leg answer order sure nothing.,14.0
a3455326-1ca7-4797-9183-54b780b4dddb,e219e2bb-401d-400f-8e0d-e7415efe42dc,2026-02-16 14:31:51.153341,Class security analysis toward size hair security.,7.0
beb14749-7bd3-48f3-9a71-d395ffe81a55,e219e2bb-401d-400f-8e0d-e7415efe42dc,2026-02-13 22:31:46.153341,Develop meeting charge cut get rise expert sit should here marriage man message yourself where east.,16.0
6e3e3583-ceaf-4711-951b-b8b5ac2e99b8,e219e2bb-401d-400f-8e0d-e7415efe42dc,2026-01-24 21:22:04.153341,Cell even edge top game cover do spring exist above opportunity question ok example buy citizen election.,17.0
eb4f7e05-5a72-4863-b5c3-e1b8e7bb69f4,e219e2bb-401d-400f-8e0d-e7415efe42dc,2026-02-04 17:39:26.153341,Ask relate spend big military measure coach.,7.0
69adf646-1fd6-4de1-bb43-ca973c73eed3,24dc4472-a18b-4659-acd3-fa36ba20106e,2026-02-17 12:38:32.153341,While return now include total whom blue tonight pull moment serious simply.,12.0
02730c16-6fc3-4772-bebd-ed2e35a9e205,24dc4472-a18b-4659-acd3-fa36ba20106e,2026-01-24 11:17:25.153341,Eat room agent thought company way fact now.,8.0
fe5daa5e-eb2f-4ea8-be85-ae2d937084e5,24dc4472-a18b-4659-acd3-fa36ba20106e,2026-02-23 22:37:28.153341,Think good media financial focus surface during production cause effect inside attack.,12.0
387d5e43-8f8b-4a7b-a22c-b92ca75f9ca1,1c091673-5eb5-4c4c-86cf-dbd9676ee902,2026-01-31 21:00:00.153341,Few something news if particularly future deep.,7.0
0e70563e-a73a-450a-9e76-61e404fbc453,1c091673-5eb5-4c4c-86cf-dbd9676ee902,2026-01-24 22:02:42.153341,Forget speech many establish scene pick important wish current degree put bad policy lay final nation.,16.0
ed9190bc-0a85-4176-adba-1690e94281a8,1c091673-5eb5-4c4c-86cf-dbd9676ee902,2026-02-18 17:09:27.153341,Media ever theory style over keep admit develop.,8.0
66c2e1d7-d040-4157-8bb5-706f5117d873,1c091673-5eb5-4c4c-86cf-dbd9676ee902,2026-02-19 23:00:29.153341,Assume bad family view must theory yeah buy.,8.0
c72ad83d-e3cc-47cd-adf0-254e1a6a8877,1c091673-5eb5-4c4c-86cf-dbd9676ee902,2026-01-29 17:36:45.153341,Actually shoulder million vote property its under light follow.,9.0
f8aeaae5-fa2d-4f82-9789-c1b787ac7bfb,0697cc75-176d-41a9-97ee-6eae224c5875,2026-01-26 20:01:48.153341,Us development toward tonight receive voice save red already heavy.,10.0
7152035f-8c29-44e7-8a88-936cb9a1870d,0697cc75-176d-41a9-97ee-6eae224c5875,2026-02-11 18:56:07.153341,About box security section itself mean lose toward thank project.,10.0
a12f8510-f06e-427e-8515-d1ac8468bbff,0697cc75-176d-41a9-97ee-6eae224c5875,2026-01-27 21:21:16.153341,Paper role fish any century.,5.0
81186200-326c-4253-9834-251369cfd8b5,0697cc75-176d-41a9-97ee-6eae224c5875,2026-01-31 21:37:14.153341,Service yard method along add remain million chair those game.,10.0
40d555e6-d308-4e16-b002-8321ed277a5f,0697cc75-176d-41a9-97ee-6eae224c5875,2026-01-28 21:18:27.153341,More yeah soon start without now other wind skill.,9.0
14dce40f-f26e-4a07-9607-c747943847ec,7db792e0-d214-45ca-ae00-4d1fe98707e8,2026-02-03 23:19:00.153341,Me crime mean particularly difference offer hour.,7.0
5233d4cd-3710-4e53-87ce-9813fd92a621,7db792e0-d214-45ca-ae00-4d1fe98707e8,2026-01-26 20:47:48.153341,Course human behind boy spend challenge kid.,7.0
370799ea-4c1e-400a-a50d-ca4d1e835880,7db792e0-d214-45ca-ae00-4d1fe98707e8,2026-02-22 19:01:53.153341,Company successful just necessary simply choose idea page pretty.,9.0
07ee53f5-0d7f-4d5f-a989-cce91b9b4b9a,7db792e0-d214-45ca-ae00-4d1fe98707e8,2026-02-17 15:49:52.153341,Life century recently buy media likely respond rock stock team they ever between.,13.0
6a0f5221-04bc-4311-ba91-f9391e7e3389,a5c25d8e-81e6-48aa-bce0-ca68923a328e,2026-02-03 19:38:55.153341,Increase value likely worker none use time.,7.0
ca628181-ce89-43a3-8693-03caf408332a,a5c25d8e-81e6-48aa-bce0-ca68923a328e,2026-01-30 14:20:02.153341,Option although toward attention election.,5.0
2f37b29b-2bae-4979-bfc1-ff9b862c0908,a5c25d8e-81e6-48aa-bce0-ca68923a328e,2026-02-07 19:48:37.153341,His reality box not raise artist walk.,7.0
62d6fd81-438b-48c0-b507-989678b9d967,f9b91a46-982d-4d93-bcd3-3d49b27b5990,2026-02-09 16:12:23.153341,A open state she memory remember.,6.0
a9fb6f18-ff6e-4dba-a16e-f4ab1629667c,f9b91a46-982d-4d93-bcd3-3d49b27b5990,2026-02-23 18:13:16.153341,Beautiful or audience ground front.,5.0
686846a3-8aea-42c3-8e01-f16f17cb137b,f9b91a46-982d-4d93-bcd3-3d49b27b5990,2026-02-06 15:22:01.154324,Effort tend leave plan structure real book future job civil.,10.0
8a942211-ed92-464c-bf5d-e08bac0e77ab,25c3724d-726f-470a-92ef-49ab0ddc439f,2026-02-19 17:38:10.154324,East write age example who southern care as red exactly coach despite class.,13.0
048b906e-5272-47f5-b2d2-55fd97a00f09,25c3724d-726f-470a-92ef-49ab0ddc439f,2026-02-21 18:54:56.154324,Can treat by north large behind enter.,7.0
681b03db-7b80-4652-912b-e93ce134543a,25c3724d-726f-470a-92ef-49ab0ddc439f,2026-02-03 19:05:39.154324,Read relationship cut standard entire peace every fast type school fall set score product eye computer.,16.0
a2c0cef9-7f21-4ba7-b015-3046ffdee974,25c3724d-726f-470a-92ef-49ab0ddc439f,2026-02-22 18:12:46.154324,Owner least character hundred ground civil.,6.0
bb94aad0-71ea-4be0-86d9-ea6e7a53d64d,5783999f-2b45-4cb6-89b6-710f9ba740c4,2026-01-27 16:13:41.154324,Prove than company language.,4.0
c74c6d95-7e65-42bd-b4c1-dba9a7990cec,5783999f-2b45-4cb6-89b6-710f9ba740c4,2026-02-16 14:44:33.154324,World where Democrat direction require sure home yet interview.,9.0
f755f6fc-c633-48d6-8fd3-86342d1f99b4,5783999f-2b45-4cb6-89b6-710f9ba740c4,2026-01-24 18:16:48.154324,Provide simply relationship actually almost amount else collection skin standard.,10.0
40132065-ed2f-4ba8-bcf1-a9feef56487b,5783999f-2b45-4cb6-89b6-710f9ba740c4,2026-01-30 21:28:07.154324,Traditional store bank own defense help.,6.0
33c332bf-f79a-40a8-952e-2884744617e3,af08e5b1-056c-4268-988c-04712b3933ec,2026-01-29 22:03:09.154324,Computer you feeling even they piece over anyone consumer worker rule pressure community surface theory fast year decade.,18.0
10e33a1c-4859-40e6-ae11-36dd3bd1abe5,af08e5b1-056c-4268-988c-04712b3933ec,2026-02-05 21:09:49.154324,Owner responsibility about make ready town include market represent.,9.0
61a3e235-bbf1-41fb-b24c-376b42093a82,af08e5b1-056c-4268-988c-04712b3933ec,2026-01-30 17:15:52.154324,Which threat economic election mother yeah behavior also still indicate economic.,11.0
6afedb30-ef5c-416f-b01a-8a0774af1760,af08e5b1-056c-4268-988c-04712b3933ec,2026-01-24 15:56:25.154324,Affect defense paper ground you believe west however wide letter get three.,12.0
d6d38829-846e-4ca7-9b93-ac557760061b,af08e5b1-056c-4268-988c-04712b3933ec,2026-02-16 15:55:18.154324,Write well discover soldier race weight PM me blood institution toward weight carry will.,14.0
9b6ec26c-8f6f-43f5-aa77-cfc7854bbd46,af08e5b1-056c-4268-988c-04712b3933ec,2026-01-31 16:40:34.154324,Mean half century might performance.,5.0
1a50833c-a31a-4d52-9a1e-b9e0180a5bee,461682db-5afc-4ede-8781-15fb12516d7c,2026-02-02 21:51:43.154324,Son long record learn expect floor interview court.,8.0
7a9c09f1-30e0-46be-90e6-3ce97a7cb882,461682db-5afc-4ede-8781-15fb12516d7c,2026-02-17 23:26:00.154324,Red area box relationship account teacher hour.,7.0
dec956bf-ea54-4b73-8260-f37e539a10b6,461682db-5afc-4ede-8781-15fb12516d7c,2026-02-05 13:46:10.154324,Send once require body training hundred dog others year such.,10.0
0da82439-826a-446c-8ecf-fc504a85855c,461682db-5afc-4ede-8781-15fb12516d7c,2026-02-09 20:59:52.154324,Major parent phone discover charge suddenly until community fill home have go product.,13.0
3b348680-3a84-481d-9bac-d3fe565f12cf,461682db-5afc-4ede-8781-15fb12516d7c,2026-01-25 19:05:09.154324,Drug activity yourself describe ask offer probably prepare.,8.0
f2f18ceb-0060-404e-97f2-3c6a35a0ef91,461682db-5afc-4ede-8781-15fb12516d7c,2026-02-17 19:22:39.154324,Recognize choose from could create challenge remember call.,8.0
999aaac1-52ae-4033-99fa-b15316cc9bd3,e2d61c8c-e2e8-4c16-a338-b0dbc2278eb7,2026-01-24 17:12:48.154324,Let wear laugh interest close paper budget similar type listen concern.,11.0
ac67a453-5e75-402c-ab2e-f5710d7054a8,e2d61c8c-e2e8-4c16-a338-b0dbc2278eb7,2026-02-16 20:08:53.154324,About here party our happy term guess.,7.0
8b5f0b26-020f-401f-9db0-af299e6a0b68,e2d61c8c-e2e8-4c16-a338-b0dbc2278eb7,2026-02-16 20:11:14.154324,Day television garden through consider later.,6.0
f960196a-a0e2-4038-bd1f-3547cc2430b5,e2d61c8c-e2e8-4c16-a338-b0dbc2278eb7,2026-02-06 15:53:05.154324,Sense small pass.,3.0
feecff2f-617d-44e3-993f-14ceb0267a36,32c8004b-dfdb-4ffc-8ae4-bfe3b939772e,2026-02-23 17:15:35.154324,Whatever after two guess whole poor officer reflect available.,9.0
b522289d-a837-4014-9413-bd61a453688f,32c8004b-dfdb-4ffc-8ae4-bfe3b939772e,2026-02-18 18:53:05.154324,Set policy interest ball what explain second every exactly western pay drug former family as forget.,16.0
b036d2c2-2c01-4a72-a961-aa537e7ab476,32c8004b-dfdb-4ffc-8ae4-bfe3b939772e,2026-02-16 16:45:11.154324,Remember modern popular care house sea mouth try from.,9.0
070216be-29b4-4cb7-8a94-260e696ef59b,8dd04eac-114a-4ed2-b19c-a93291d14dab,2026-02-07 14:53:22.154324,Themselves tough manager yes affect enjoy would.,7.0
a60dcfb4-4a23-4afc-a8b0-9e4acf95fd54,8dd04eac-114a-4ed2-b19c-a93291d14dab,2026-02-06 18:00:04.154324,Approach wind tonight certain spend indeed market hope walk miss house.,11.0
3b9e05d8-3ec5-458a-9f1c-43a7cd5314ae,8dd04eac-114a-4ed2-b19c-a93291d14dab,2026-02-17 23:49:23.154324,Quickly foot a know easy issue agent machine east trial others identify.,12.0
866361c1-e0c6-444e-8ca2-f26b06d658a2,8dd04eac-114a-4ed2-b19c-a93291d14dab,2026-02-16 14:51:40.154324,Vote much party fish total about toward.,7.0
ff072153-c117-4748-a70d-34cd27e13648,8dd04eac-114a-4ed2-b19c-a93291d14dab,2026-01-25 17:38:26.154324,Watch trial structure economic free me reflect image especially lawyer.,10.0
004a9d7d-c6ee-47bf-affe-faf1ba5fcb08,8dd04eac-114a-4ed2-b19c-a93291d14dab,2026-01-28 20:07:41.154324,Design indicate field me each tree.,6.0
c03d0cad-c922-45e7-94b0-64cd36d9fbca,9938f449-9e27-4eec-9f39-5af73b0d23e8,2026-01-25 20:02:48.154324,Seat investment same part test group.,6.0
964069c2-2af9-4edc-af5b-7c64e31db62d,9938f449-9e27-4eec-9f39-5af73b0d23e8,2026-02-01 19:30:03.154324,Worry everything financial where fall respond focus discover six light.,10.0
ac1bff45-c015-4ca8-9f8b-6761966f7ae2,9938f449-9e27-4eec-9f39-5af73b0d23e8,2026-02-02 20:42:25.154324,Least key husband talk in play success she.,8.0
f552b935-d9d5-476a-832a-f12a17727c48,9938f449-9e27-4eec-9f39-5af73b0d23e8,2026-02-16 20:29:10.154324,Discussion quality nation can make represent listen above my successful since.,11.0
9643b848-c945-4db2-92f9-4a4eff45d75f,9938f449-9e27-4eec-9f39-5af73b0d23e8,2026-02-07 22:58:53.154324,Suggest thing daughter half stop deal health gun what turn.,10.0
8c10bc19-fc00-450e-a496-a8463dae926b,9938f449-9e27-4eec-9f39-5af73b0d23e8,2026-01-31 17:55:07.154324,Alone hope out least form personal money black word respond detail single campaign out one.,15.0
f4d102dd-7d57-43f8-9981-0974d6a8bdc7,9938f449-9e27-4eec-9f39-5af73b0d23e8,2026-02-03 22:03:58.154324,Education nature level high friend party memory single.,8.0
d886969f-cf6b-4cb9-a794-c2b6fdfc1d44,e09a71d4-3e9f-4a53-8598-c05ef0c2c79d,2026-02-18 16:29:13.154324,Build drive benefit candidate truth measure particular American among lay old science partner.,13.0
dc8f7089-72e9-4ee4-912c-a062c6e21897,e09a71d4-3e9f-4a53-8598-c05ef0c2c79d,2026-02-11 21:08:27.154324,Sometimes actually blood laugh analysis range war other other.,9.0
ad6878ed-5f31-4a7d-b7bf-6b97e3e7eeef,e09a71d4-3e9f-4a53-8598-c05ef0c2c79d,2026-02-23 23:34:51.154324,Home direction could certain that commercial.,6.0
f39a3d8f-1caf-4e9a-8de2-cfaaa740c60c,bd8c18da-704b-4d5c-af3c-18e6218d1a48,2026-02-18 20:37:38.154324,Hospital reach own everyone candidate argue movie listen say rich person fall down figure bar level.,16.0
17f38f17-baa0-4f7f-b7b3-87c168e82105,bd8c18da-704b-4d5c-af3c-18e6218d1a48,2026-02-08 23:33:53.154324,Magazine scientist off miss or word physical term huge subject describe work huge than.,14.0
0a8933ad-1934-494d-957d-737257bf9f58,bd8c18da-704b-4d5c-af3c-18e6218d1a48,2026-02-21 20:32:06.154324,Draw season let anyone similar other machine.,7.0
bd14ab99-66b8-43ac-9754-89ff5b6cf740,bd8c18da-704b-4d5c-af3c-18e6218d1a48,2026-02-18 18:03:54.154324,Clear situation prepare if defense.,5.0
8ee13bf2-aff8-4270-aed6-db67b4bdfcbd,bd8c18da-704b-4d5c-af3c-18e6218d1a48,2026-02-14 18:59:50.154324,Determine such Mr charge firm training like begin bad party with trip next religious.,14.0
673a66ab-3ec2-4a57-970c-2386cd9a3cbb,bd8c18da-704b-4d5c-af3c-18e6218d1a48,2026-02-21 20:13:31.154324,Evening much just open once ready station enjoy enough head research scientist.,12.0
a640d845-a169-4aa0-94af-ef7ea2458e48,bd8c18da-704b-4d5c-af3c-18e6218d1a48,2026-01-27 13:32:13.154324,Project number shake girl dream center six.,7.0
2f1d747d-2442-425f-8780-6f057d6f0c5b,9aa0d22e-ec3b-457b-bb12-8b6671182668,2026-02-12 20:27:34.154324,Phone full attention a plant.,5.0
35b60c17-c07b-4ef1-9f32-50f71d83f146,9aa0d22e-ec3b-457b-bb12-8b6671182668,2026-01-25 18:39:10.154324,Friend political police significant agency everything kid challenge house kitchen.,10.0
ed12633e-6731-4b47-9c8b-4f558d1d87e8,9aa0d22e-ec3b-457b-bb12-8b6671182668,2026-01-30 20:49:21.154324,Front glass identify national media defense past move open worry up worry produce natural.,14.0
bfda5544-59d9-43a8-8c4b-35de3a70fe34,9aa0d22e-ec3b-457b-bb12-8b6671182668,2026-02-20 18:40:29.154324,Stuff later dream five animal treat push pull art thousand.,10.0
23152fe7-9ee7-468c-bf01-5d3c43b39bec,9aa0d22e-ec3b-457b-bb12-8b6671182668,2026-02-07 20:26:17.154324,Today physical tend clearly close capital.,6.0
454ab128-6876-4c36-886e-60fa59ab59d9,9aa0d22e-ec3b-457b-bb12-8b6671182668,2026-02-10 20:16:46.154324,Entire out which ask candidate pressure seem then box among painting whose.,12.0
2b079cf7-31c9-45e8-b499-942a123493e5,9aa0d22e-ec3b-457b-bb12-8b6671182668,2026-02-23 21:24:05.154324,Laugh author voice occur quality after nearly.,7.0
58d92be0-925a-40cb-8b4c-de299a682550,9aa0d22e-ec3b-457b-bb12-8b6671182668,2026-02-23 20:32:07.154324,Offer history child your describe language mouth sense you ground card computer several resource leader.,15.0
bea7d185-f027-4c89-bc75-c1954808f2d3,dcebd367-cd6b-4de7-b8bc-0f22d7b7ff48,2026-01-30 15:39:13.154324,Blood TV direction wait sing.,5.0
b7aa5571-0719-47c0-a412-efb2f714c3e3,dcebd367-cd6b-4de7-b8bc-0f22d7b7ff48,2026-01-25 23:38:36.154324,Kitchen environment throw religious.,4.0
789e1e38-7fc4-4f8e-a8d3-b93bcab72114,dcebd367-cd6b-4de7-b8bc-0f22d7b7ff48,2026-02-03 21:50:29.154324,Employee opportunity clearly upon study dream parent institution activity together for enough thing first.,14.0
4d15daad-d6ac-42ea-a6eb-a6a1f7439c93,dcebd367-cd6b-4de7-b8bc-0f22d7b7ff48,2026-02-11 18:32:21.154324,Up ask nice strategy hundred agent drug father surface method play attention remain glass.,14.0
82f8b5de-e5c6-4d87-abc1-6a66a9da2c5e,dcebd367-cd6b-4de7-b8bc-0f22d7b7ff48,2026-02-20 23:38:01.154324,Face admit set party life decision good sell another next.,10.0
5afc71dc-7f35-4f2a-aa75-32074dbbba18,dcebd367-cd6b-4de7-b8bc-0f22d7b7ff48,2026-01-31 16:47:57.154324,Peace line reason candidate method partner outside begin study sometimes available either parent certainly assume charge democratic.,17.0
ffbec78a-7e6f-4a24-b4b6-22f7d5db3996,dcebd367-cd6b-4de7-b8bc-0f22d7b7ff48,2026-02-06 17:46:54.154324,Of property world member.,4.0
6ee72992-f112-442a-90c8-083292de8101,dcebd367-cd6b-4de7-b8bc-0f22d7b7ff48,2026-02-13 15:57:18.154324,Themselves manager nearly plan along least history sit hour court arm.,11.0
e07f1823-d86b-42a6-840f-53e2334e51e3,0264bd0f-3320-4586-ba17-26cfd701b5a2,2026-02-18 15:37:18.154324,Mind appear example social role daughter activity protect question less.,10.0
b97150bf-7cc8-43bd-9b40-14354c29fa72,0264bd0f-3320-4586-ba17-26cfd701b5a2,2026-01-25 18:28:47.154324,Final person table community evidence on memory week watch record option movement system or.,14.0
fc480272-9575-46a8-8407-c8fd2058bddd,0264bd0f-3320-4586-ba17-26cfd701b5a2,2026-01-24 14:53:06.154324,Clear later avoid list green site shake young pull feel grow full never law.,14.0
dd0c6c51-dd02-4833-8049-8890ed198e8c,0264bd0f-3320-4586-ba17-26cfd701b5a2,2026-02-05 18:13:58.154324,Theory there rich especially leave pick open itself enter occur sit example.,12.0
a6ee4b92-8d8f-401f-9230-ddc32a5d1cc7,0264bd0f-3320-4586-ba17-26cfd701b5a2,2026-02-21 18:51:29.154324,Run brother media outside trial memory bag recently cold.,9.0
dd41ca5e-352c-4e51-bf7b-12c8ab838f8e,0264bd0f-3320-4586-ba17-26cfd701b5a2,2026-02-16 17:18:26.154324,Traditional relate color particularly must light career Republican small forget despite call performance our exactly skill business anything building.,19.0
9c00721f-3374-4e19-b38c-2f4f81641aaf,0264bd0f-3320-4586-ba17-26cfd701b5a2,2026-01-31 19:15:32.154324,Market test yourself total tough sell others century.,8.0
a0eaa8f7-e46e-4ccb-a516-1822251a2187,1410b37c-ec33-4ab9-9da0-2e027f482c49,2026-02-13 23:09:03.154324,Might feeling real international enough way.,6.0
17d57026-89c5-45a9-bf51-805ae855ff3a,1410b37c-ec33-4ab9-9da0-2e027f482c49,2026-02-14 18:03:26.154324,With floor material produce say leave explain loss important mouth many big class hotel brother garden.,16.0
718a7bd3-4c03-4adb-ace6-2de7ba241f86,1410b37c-ec33-4ab9-9da0-2e027f482c49,2026-02-12 20:46:58.154324,Perhaps later yourself animal sit down follow compare.,8.0
cd0bb5c3-0c5b-4bbf-b636-23917e51a381,1410b37c-ec33-4ab9-9da0-2e027f482c49,2026-02-16 20:33:27.154324,Need hair must security majority already would which recently collection kitchen.,11.0
e8cad3a2-e15e-492b-8a50-8ad0038d9907,1410b37c-ec33-4ab9-9da0-2e027f482c49,2026-01-26 21:18:36.154324,Find night foreign feeling just place budget avoid eye official surface son total long.,14.0
ea89ef62-d9ec-4ddb-8339-c6ac538845b8,1410b37c-ec33-4ab9-9da0-2e027f482c49,2026-01-26 17:28:30.154324,East goal staff actually.,4.0
2d86ec18-fb82-4c9c-906d-4b024b25862f,1b2bec6e-16e5-421d-869d-81e93c9da919,2026-01-27 20:38:08.154324,Major similar you owner small marriage behind realize coach believe reveal practice nothing practice sell agency attorney member picture.,19.0
44417631-e014-44d7-9a19-86325e61130f,1b2bec6e-16e5-421d-869d-81e93c9da919,2026-02-20 13:42:27.154324,One best travel pull want walk.,6.0
1c04aec8-e661-4e07-af54-d70cfefd25a8,1b2bec6e-16e5-421d-869d-81e93c9da919,2026-02-04 20:34:24.154324,And opportunity wonder behind spend pass.,6.0
5455a01d-bb34-4526-a625-fb83bdbef5b5,1b2bec6e-16e5-421d-869d-81e93c9da919,2026-02-18 19:43:01.154324,Guess mission available thank member travel town century catch white expect common.,12.0
62f40c1a-42ff-4c7c-aaa7-f63d8cbc3a39,5d19ac58-0868-447d-bd4d-34a2e6864a66,2026-02-05 22:33:08.154324,Air degree focus rule marriage call thank hope fact from marriage system become wonder interview probably enough.,17.0
ab997881-f8a2-4652-b92e-5d4f099b6ed1,5d19ac58-0868-447d-bd4d-34a2e6864a66,2026-02-16 23:57:13.154324,Officer price easy appear town local sit.,7.0
529e0e2e-b064-42f6-96c2-19aa4d85aee7,5d19ac58-0868-447d-bd4d-34a2e6864a66,2026-02-12 17:59:14.154324,So speak information accept less form think who successful.,9.0
3d60eef0-2f51-43ba-b190-5c0b6645b742,5d19ac58-0868-447d-bd4d-34a2e6864a66,2026-02-19 14:26:35.154324,Course do discover spend finish language news carry much.,9.0
00380946-d61d-46b1-ab48-8bc9af289769,5d19ac58-0868-447d-bd4d-34a2e6864a66,2026-02-15 17:46:56.154324,Thought kitchen by cover American.,5.0
e3d555fc-9d8f-4655-affd-41336b6c92b7,5d19ac58-0868-447d-bd4d-34a2e6864a66,2026-02-17 16:02:47.154324,Property management range peace interesting consumer investment take.,8.0
2377f986-54b7-4db5-a4fb-e37b80792469,30fe7421-bf0b-4e32-9c8a-5d0c488eb5b9,2026-01-24 20:09:15.154324,Away hotel state all toward lay reality threat same threat something.,11.0
613330eb-68cc-4300-97de-03b78f0de95b,30fe7421-bf0b-4e32-9c8a-5d0c488eb5b9,2026-02-09 18:53:20.154324,Necessary without determine or born baby traditional.,7.0
908f3837-e177-48cf-a17d-4bed8efc71dd,30fe7421-bf0b-4e32-9c8a-5d0c488eb5b9,2026-02-05 19:49:19.154324,Environmental major light tonight his foot like raise.,8.0
b16177a4-0945-4758-bf88-d561eca3664f,30fe7421-bf0b-4e32-9c8a-5d0c488eb5b9,2026-02-23 18:25:48.154324,Economy lawyer toward movement feeling main like deep woman.,9.0
f1bce41e-d206-4db0-8e4f-cfb0ee5af8a4,34ed8077-fe76-41b4-b294-5f1ad0d16d99,2026-02-17 12:06:45.154324,Style personal despite thank account deal another glass south where point include operation send green.,15.0
bfa2253d-dd07-4b97-8e60-c0537d6761ee,34ed8077-fe76-41b4-b294-5f1ad0d16d99,2026-01-26 14:56:25.154324,Professor condition save approach kitchen candidate assume drop nation choose.,10.0
01f6801b-6b33-491e-bdde-562c222efd59,34ed8077-fe76-41b4-b294-5f1ad0d16d99,2026-02-22 19:10:02.154324,Relate assume free impact son assume.,6.0
d2d6d4de-c1a7-4df0-a90b-9cbb0af8b9ea,83b7490a-f2db-44ac-be86-0757c3118c32,2026-02-12 18:33:38.154324,Of quality order decide discuss develop management small nothing like bar last rock church under ready similar no science.,19.0
1a1777c7-6bdd-4ae9-a96a-5874be924d7c,83b7490a-f2db-44ac-be86-0757c3118c32,2026-02-17 17:35:35.154324,Industry house determine method reality series sign executive.,8.0
2d6ef7e3-6561-49ba-bd5e-6daf1476b715,83b7490a-f2db-44ac-be86-0757c3118c32,2026-02-16 17:06:10.154324,Would house cell attack section hear during from us stock rather cultural note bad stop.,15.0
6b3818a6-73fc-4c0d-9712-853f329d4ee8,83b7490a-f2db-44ac-be86-0757c3118c32,2026-02-01 19:00:10.154324,Less ten few drop nature suffer usually owner summer.,9.0
4d566a97-c287-438d-aa04-beb32a5342b0,83b7490a-f2db-44ac-be86-0757c3118c32,2026-02-05 19:55:30.154324,Can thought talk director thank entire former decade only require.,10.0
298b78e9-762c-4e7c-a730-38fa478524da,83b7490a-f2db-44ac-be86-0757c3118c32,2026-01-26 20:59:35.154324,Seem organization military yeah set alone forget identify region.,9.0
31def19d-dcf3-4de6-9b76-9d1eb9f7a119,83b7490a-f2db-44ac-be86-0757c3118c32,2026-01-31 20:36:59.154324,President chair science worry bad here size lay reach.,9.0
448cce60-c47f-45fb-8a3a-7ff31ba4a8c2,83b7490a-f2db-44ac-be86-0757c3118c32,2026-02-06 22:46:39.154324,Within require third concern resource available among mother light.,9.0
39586302-f681-4dae-aae2-3dde74d1afd1,8bcf2bad-991d-48d7-8bc8-9681c4614ade,2026-02-14 20:30:49.154324,Fish bag enjoy president skill general serve stuff energy.,9.0
3724580e-e2a8-448a-a8b3-25a220fdb669,8bcf2bad-991d-48d7-8bc8-9681c4614ade,2026-02-06 20:46:01.154324,Again point develop young behind maybe ground program peace public wait buy.,12.0
362f5c87-6a81-4527-ac65-764083230138,8bcf2bad-991d-48d7-8bc8-9681c4614ade,2026-02-20 17:06:20.154324,Author without main own sister machine face.,7.0
78de0c4f-d313-42b8-a7a6-29bc92db6624,8bcf2bad-991d-48d7-8bc8-9681c4614ade,2026-01-25 18:05:26.154324,This development group sense me building watch.,7.0
65ce4131-21a7-4b7c-b0ed-5366f7d0dd74,8bcf2bad-991d-48d7-8bc8-9681c4614ade,2026-02-15 18:00:59.154324,Buy pretty woman save relationship page no near office.,9.0
ec32562b-9ff9-4908-baff-e2b1c3b2b931,8bcf2bad-991d-48d7-8bc8-9681c4614ade,2026-01-29 17:06:10.154324,Begin environment most foot my break son.,7.0
1c969c06-8840-4945-b550-e9af74c76edf,8bcf2bad-991d-48d7-8bc8-9681c4614ade,2026-01-25 23:43:03.154324,Thank cold message forget like billion open see.,8.0
d124931f-f60b-4388-bff0-1f4d32e12f96,19e460bb-b0cc-42f9-976c-6cbac044203c,2026-02-06 16:56:30.154324,Everybody speak early short.,4.0
9a75a537-f328-44e4-ad85-266f449efc54,19e460bb-b0cc-42f9-976c-6cbac044203c,2026-02-18 14:46:33.154324,Feel Mrs star voice model wish when way management so.,10.0
89a6557e-177d-4dfd-8630-6ba84f8e4354,19e460bb-b0cc-42f9-976c-6cbac044203c,2026-02-07 23:45:24.154324,Mouth well similar catch expert buy pressure build yet beautiful boy.,11.0
