post_id,user_id,timestamp,content,content_length
be0396b2-5303-4c9b-bd18-ef9870409e1f,05bc2b6c-885a-4cbc-997d-4501ae274202,2026-02-17 20:34:53.132925,At parent rule college market want.,6.0
eff3f53e-9f8d-431a-8fe9-ae31666e3ba0,05bc2b6c-885a-4cbc-997d-4501ae274202,2026-02-19 22:45:07.132925,Actually both understand article want small.,6.0
31bc22d4-24e5-49c8-a144-2f0b7804e8bd,767fd49a-f5f2-4e7b-8d2a-c50c0ffd1cf2,2026-02-23 17:27:28.132925,Social brother leave meet management protect control fact compare.,9.0
8b99e30b-1f9f-44d9-ba85-e29c79c28cf5,767fd49a-f5f2-4e7b-8d2a-c50c0ffd1cf2,2026-02-12 17:30:31.132925,Team tax employee kid something involve certainly fall four base.,10.0
fc7045a8-fd97-4d08-bd5d-0d30f95a365b,767fd49a-f5f2-4e7b-8d2a-c50c0ffd1cf2,2026-02-15 23:47:49.132925,Stock measure most our thing crime sister white great.,9.0
cf871faa-5d81-4afb-9e5b-b97900d32ae6,767fd49a-f5f2-4e7b-8d2a-c50c0ffd1cf2,2026-02-20 16:33:00.132925,Ok team town because true feeling share.,7.0
8b8c9423-14ae-4702-aeb5-71af04bb9ae2,767fd49a-f5f2-4e7b-8d2a-c50c0ffd1cf2,2026-02-02 19:17:19.132925,Vote money thank specific little effect.,6.0
d2dadb54-c234-467f-a072-2ac607bea2a7,767fd49a-f5f2-4e7b-8d2a-c50c0ffd1cf2,2026-02-23 17:44:01.132925,Office look control individual next outside.,6.0
ed91cd39-3e65-4c35-842b-efc91794b29c,767fd49a-f5f2-4e7b-8d2a-c50c0ffd1cf2,2026-01-24 17:51:10.132925,Local stage probably federal message lead.,6.0
3afb9470-d51b-46e5-8c31-bef29484cca2,57df2413-bd93-4dc1-ab35-bebbcbdc36c6,2026-02-04 17:27:46.132925,Few role Congress cultural argue store.,6.0
f4f8cacc-a268-4dcc-913b-cb8f305c346c,57df2413-bd93-4dc1-ab35-bebbcbdc36c6,2026-02-08 19:36:05.132925,Similar class education even might it.,6.0
6c4ebb0c-5392-4206-8a24-0d4e3e0e1cee,57df2413-bd93-4dc1-ab35-bebbcbdc36c6,2026-02-11 16:01:39.132925,Condition community ago improve.,4.0
8c9d90e6-c53c-4394-b0b2-a111f6ac67cf,57df2413-bd93-4dc1-ab35-bebbcbdc36c6,2026-02-04 23:27:38.132925,Something certain western particularly they along himself pay avoid across walk board.,12.0
0e713fd3-c206-4e81-9eb9-b2d6b6da5d38,b7728602-ac41-46b1-9d4d-a7c505979117,2026-02-20 19:54:18.132925,See crime drive six sing method work sell natural.,9.0
874b75fa-1a29-4e05-9b95-23a9ab859ff0,b7728602-ac41-46b1-9d4d-a7c505979117,2026-02-10 20:37:49.132925,All look reflect industry energy usually fact bill open street fine pass support single blood.,15.0
78246b81-80a7-46f4-a15b-ed67f386ff99,b7728602-ac41-46b1-9d4d-a7c505979117,2026-02-13 22:43:22.132925,Time old religious last charge lose move market particularly feel want.,11.0
29d974ad-36a7-496b-a59c-5217dd52eab6,b7728602-ac41-46b1-9d4d-a7c505979117,2026-01-24 16:36:08.132925,Expect so statement tonight theory goal serious likely expect long school sell present service wait.,15.0
24fa5b35-262d-46ec-b96d-1504400b944a,b7728602-ac41-46b1-9d4d-a7c505979117,2026-01-29 20:58:16.132925,Later give wrong article rather who base week amount state general top Mrs sing.,14.0
344903bd-4862-4932-b9ac-5379f36c0680,c93a6f26-0d79-4805-93e5-6d346271062a,2026-02-05 19:32:35.132925,At race seem pattern society theory argue list someone.,9.0
c1d76c40-be2c-47d4-b9e3-a9b22bfd1f18,c93a6f26-0d79-4805-93e5-6d346271062a,2026-02-03 13:32:43.132925,Really stuff little lose today nature argue fire account which.,10.0
8e8b8b0d-be79-43ca-9da9-f138cee9cea0,c93a6f26-0d79-4805-93e5-6d346271062a,2026-01-27 18:46:25.132925,Financial consider action laugh discover recent article.,7.0
a69cf49a-6eb9-44e9-b727-18e590e55148,07755c72-f87c-4886-983c-e7a228a14413,2026-02-07 14:28:50.133940,Significant fall man record seven long measure goal myself worry likely couple happen anything three reach people probably eat.,19.0
c0a8691f-d01f-4190-b19d-4b4ec82547ed,07755c72-f87c-4886-983c-e7a228a14413,2026-02-10 20:23:26.133940,Reduce short strong quite serve right present nor operation field us education.,12.0
313e6dba-2e8e-4156-9f30-b8bc1a2f2eff,07755c72-f87c-4886-983c-e7a228a14413,2026-01-30 19:11:25.133940,Place wait prepare more can raise notice.,7.0
3e3a4ca6-f293-470e-a46b-88d5c586a577,07755c72-f87c-4886-983c-e7a228a14413,2026-01-28 23:19:32.133940,Price just debate culture often cut bed set sure religious lose during generation.,13.0
56103ef4-ed63-427b-a943-48ab09a83c62,07755c72-f87c-4886-983c-e7a228a14413,2026-02-09 21:50:06.133940,Close senior authority approach card night community.,7.0
01421368-2896-4ce2-8263-9bf55c9251dc,07755c72-f87c-4886-983c-e7a228a14413,2026-02-06 22:01:43.133940,Mrs those red adult marriage over easy garden Democrat action hope parent.,12.0
86639bc7-1770-4d03-931d-cfd66b1b6e93,07755c72-f87c-4886-983c-e7a228a14413,2026-02-23 16:26:59.133940,Way successful story hold arm man himself answer note law.,10.0
cb85ab05-e313-4386-9d79-948b4506b38c,602b2098-02a1-4fd8-a478-5a49e0314409,2026-01-28 19:57:23.133940,Cut continue science attorney environment ten fast item military positive market care different country suffer last.,16.0
361f0588-fc21-47d9-839a-3af54b592097,602b2098-02a1-4fd8-a478-5a49e0314409,2026-01-29 18:32:38.133940,Most study know end service foreign information.,7.0
0b48a739-67c4-430d-9167-f982ac4212f2,602b2098-02a1-4fd8-a478-5a49e0314409,2026-02-21 20:36:28.133940,Become defense pattern teach laugh clearly.,6.0
018b3c3b-d58c-4b1b-87f6-bc63355fd19a,91d38578-46fa-4776-9ad7-6ea2c3d1c75f,2026-01-24 17:21:35.133940,Baby speech throw hair crime address.,6.0
df1ebeaa-ae70-4a4d-85c9-ec61ebdc30b4,91d38578-46fa-4776-9ad7-6ea2c3d1c75f,2026-02-05 21:06:59.133940,Letter imagine high animal impact.,5.0
d38b492e-4f9f-497c-a3d7-eb36d63d39ce,91d38578-46fa-4776-9ad7-6ea2c3d1c75f,2026-01-27 17:10:36.133940,Race campaign attack campaign if view total you director who staff total garden.,13.0
6ed221aa-2a5a-46c6-ad59-09d6c7678eae,91d38578-46fa-4776-9ad7-6ea2c3d1c75f,2026-02-21 20:47:59.133940,Continue various affect father.,4.0
19ce538c-09b9-471e-b83f-c5bf4c138f85,91d38578-46fa-4776-9ad7-6ea2c3d1c75f,2026-01-28 20:01:29.133940,Science hold spend build it.,5.0
aef63c00-d473-40b2-b8a2-9810ff295b0e,91d38578-46fa-4776-9ad7-6ea2c3d1c75f,2026-02-15 18:39:35.133940,Edge window approach poor according rich where age my figure month.,11.0
5668f859-8837-4705-828b-639c3e9804e4,91d38578-46fa-4776-9ad7-6ea2c3d1c75f,2026-02-19 20:36:37.133940,Make wear material hand get perhaps it.,7.0
c522e7ef-0490-4748-9cd2-547055c6c1bc,91d38578-46fa-4776-9ad7-6ea2c3d1c75f,2026-01-24 14:36:09.133940,So good board opportunity resource just police pay him performance carry own than.,13.0
ddb0859f-2d70-49a4-93b2-32979adbf8fc,a1c10e8b-872c-4318-b116-21f0a1180149,2026-01-26 15:25:43.133940,Prove resource value though second.,5.0
a8022df3-fb08-4198-8319-25b00ed8542c,a1c10e8b-872c-4318-b116-21f0a1180149,2026-02-17 19:05:44.133940,Approach best beyond likely star building add play part send.,10.0
d0053688-4f24-450c-bf3e-b6ea0f22c6e7,a1c10e8b-872c-4318-b116-21f0a1180149,2026-02-23 18:14:28.133940,Of do job good administration door prevent professional team meet effect far.,12.0
fdeddab1-1de2-426c-8143-87a9d1b7a018,a1c10e8b-872c-4318-b116-21f0a1180149,2026-02-02 22:25:32.133940,Section subject seek beat human would if.,7.0
7e66f588-f1cb-4560-ac29-d4a9abb8777a,a1c10e8b-872c-4318-b116-21f0a1180149,2026-02-23 23:05:35.133940,Start event agree claim during research interview be push only ground point also voice environment buy dog federal.,18.0
19d294a0-9d39-417e-abf6-8fe6598df41e,a1c10e8b-872c-4318-b116-21f0a1180149,2026-01-29 16:45:06.133940,More of explain strategy dinner entire.,6.0
f391d9bd-dd1b-49e4-97b2-2a40882a22dc,a1c10e8b-872c-4318-b116-21f0a1180149,2026-01-28 23:19:38.133940,Glass fire activity live analysis where senior condition use leader seem.,11.0
4ec6c51c-e24c-4e3f-870d-9e378779897c,2b930cc3-bb1f-424d-b918-9246a77ec081,2026-02-01 16:33:49.133940,Institution civil age hand beautiful economic bad action maybe every material bit.,12.0
11919603-8336-402b-b5e4-2b5fc8f3cda5,2b930cc3-bb1f-424d-b918-9246a77ec081,2026-02-11 19:30:26.133940,Rest real range maintain family husband small fund allow style once resource.,12.0
1e912e49-378f-4316-8f35-f0f27ce677e4,2b930cc3-bb1f-424d-b918-9246a77ec081,2026-02-11 17:27:57.133940,Concern hear make recognize phone form help under gun interest drive building.,12.0
621eb99f-db24-4499-ba9b-baabc828a76d,2b930cc3-bb1f-424d-b918-9246a77ec081,2026-01-28 21:31:43.133940,Decision voice world draw also.,5.0
593375d4-df24-4430-8aff-3efef19a5422,c837bbb5-ccae-4ebb-b3eb-ba663e80d29f,2026-02-18 16:40:21.133940,It remain stop spring rise real value without Democrat.,9.0
e63857f0-b61c-4689-9fd6-70c654fec402,c837bbb5-ccae-4ebb-b3eb-ba663e80d29f,2026-02-06 18:34:07.133940,Age about also born rather close start able win behind.,10.0
1764116a-463b-48dd-99fe-44b269cb2a22,c837bbb5-ccae-4ebb-b3eb-ba663e80d29f,2026-02-05 19:04:13.133940,Between wife quite grow force rich.,6.0
89127cc1-02f3-473e-8606-96cfd79c44fb,c837bbb5-ccae-4ebb-b3eb-ba663e80d29f,2026-01-29 18:52:43.133940,Fall move increase upon close.,5.0
c48332c9-c298-400e-8802-06271b923d11,c837bbb5-ccae-4ebb-b3eb-ba663e80d29f,2026-02-21 21:53:59.133940,Father president black result let Mr task some anyone us.,10.0
e28fe730-885d-4d6f-8b49-89f4113020d7,c837bbb5-ccae-4ebb-b3eb-ba663e80d29f,2026-02-01 21:05:03.133940,Receive man decade free find help choose yard.,8.0
fa7ab04b-af83-4b78-a943-db0fc197c8b6,c837bbb5-ccae-4ebb-b3eb-ba663e80d29f,2026-01-29 19:28:14.133940,Pull organization might feeling school increase four science this suggest star any break office activity part institution.,17.0
c6c41f18-d2e2-4606-8217-4d4a3fb8ebd9,1a63aab2-a170-4099-a136-b097c4b19a11,2026-02-16 18:44:04.133940,Whatever never range south officer to require writer natural explain.,10.0
fbf99e1e-de94-489a-96da-f1eb4e2f7977,1a63aab2-a170-4099-a136-b097c4b19a11,2026-02-02 16:48:12.133940,Name finally agree debate resource what.,6.0
9f19a02c-c701-4216-95da-92deeff5e184,1a63aab2-a170-4099-a136-b097c4b19a11,2026-02-09 23:35:22.133940,Animal realize daughter stop citizen whether later.,7.0
29ab76a4-64cb-4895-ba15-67733b27e89f,aa74d4ef-8d87-4702-b15a-d455667efe7c,2026-02-21 16:41:33.133940,Growth feel college arm around.,5.0
06e1db97-1579-4c11-a40f-d5c106621b84,aa74d4ef-8d87-4702-b15a-d455667efe7c,2026-01-29 21:43:45.133940,Six number research billion factor relate shoulder top whom.,9.0
ce27038e-0ed0-4639-a15c-6c1c2f5a6189,aa74d4ef-8d87-4702-b15a-d455667efe7c,2026-01-27 21:52:27.133940,Lawyer determine about prepare sometimes nation effect pressure enjoy expert anyone yes.,12.0
f9d3edc8-e157-43d3-b9d6-4264c5fe6eaa,aa74d4ef-8d87-4702-b15a-d455667efe7c,2026-01-27 20:59:40.133940,Easy only article bring truth discuss southern thousand.,8.0
545859a3-459a-4386-9172-5f7893184bb8,aa74d4ef-8d87-4702-b15a-d455667efe7c,2026-02-16 17:50:11.133940,Identify be product personal room point international right.,8.0
174a4d30-52c3-4bc4-9f32-09338e9b15db,aa74d4ef-8d87-4702-b15a-d455667efe7c,2026-02-01 23:46:28.133940,Specific develop party run everybody within billion write born nearly recognize poor material.,13.0
6a0bbbcc-5fe8-4f44-ad34-9969b4f9ca8c,dbfae0ac-110b-400b-8784-473d9bc65785,2026-02-18 19:18:37.133940,Around some above husband bed who doctor.,7.0
70fe1728-5c03-46b4-a260-b1bd6837e962,dbfae0ac-110b-400b-8784-473d9bc65785,2026-02-18 17:51:59.133940,Degree deal wait first become anyone today produce in gun second phone mean policy until.,15.0
bdd4672a-3633-41c2-bdb4-b3dd136536d6,dbfae0ac-110b-400b-8784-473d9bc65785,2026-02-14 19:53:37.133940,Find same and prevent training whether expect PM budget send industry take hard.,13.0
df0c7b60-85e4-44dc-a307-785cd357c7b0,dbfae0ac-110b-400b-8784-473d9bc65785,2026-01-26 22:35:11.133940,Peace approach wind reach once large suggest.,7.0
7e5f198e-c0a9-4d7f-b8ac-791f902b9739,dbfae0ac-110b-400b-8784-473d9bc65785,2026-02-20 21:26:36.133940,Tend central term school professor strong require some.,8.0
68bad14f-2f61-457c-95a4-963da12041ee,dbfae0ac-110b-400b-8784-473d9bc65785,2026-02-20 17:35:29.133940,Exist deep section light pull today.,6.0
88b8be4d-74ed-46e1-873c-bd5321ecd057,dbfae0ac-110b-400b-8784-473d9bc65785,2026-02-07 15:23:20.133940,Majority money per because old every Democrat decide.,8.0
a49554de-d316-4055-82d2-87ced226c99e,dbfae0ac-110b-400b-8784-473d9bc65785,2026-02-02 18:35:39.133940,Significant front young assume any well name young.,8.0
2b6bd5db-470e-4e7a-9b0d-ed5abfca1938,d26754f7-22fe-41b8-9965-287773cebe35,2026-02-18 17:31:16.133940,Recognize crime environmental tree public their young.,7.0
7040a290-f902-4522-bc9c-f2a5552f529e,d26754f7-22fe-41b8-9965-287773cebe35,2026-02-15 17:27:42.133940,Site skill store every high author away billion fight.,9.0
369b3ef8-82d6-4977-a86e-ad8c63918bc1,d26754f7-22fe-41b8-9965-287773cebe35,2026-02-06 23:52:58.133940,Stop southern game store service talk receive.,7.0
d6d7d705-f497-4e0c-8187-e8d7dddfeb6a,d26754f7-22fe-41b8-9965-287773cebe35,2026-01-28 16:55:23.133940,Design direction leader face should seek.,6.0
aec0f844-9fed-4830-bf7c-69e076925315,d19b6284-5f7e-46cd-9419-433ea9e21567,2026-02-02 17:20:21.133940,Table number amount worker country evening.,6.0
e6285cbd-c0bf-431e-9a5e-259e56ac8f28,d19b6284-5f7e-46cd-9419-433ea9e21567,2026-02-20 16:54:22.133940,Country cut four soon.,4.0
ba7ea7cb-1241-4273-a6c0-ea476604fa7b,d19b6284-5f7e-46cd-9419-433ea9e21567,2026-01-26 22:57:35.133940,Media level instead model movement customer chance everybody nice become decide between current responsibility.,14.0
395e0ad1-01e9-4723-a2d4-5add387f07b5,d19b6284-5f7e-46cd-9419-433ea9e21567,2026-01-26 20:41:09.133940,Practice everyone eye and.,4.0
821b49b6-047f-4a05-97c8-86b3f47b50de,d19b6284-5f7e-46cd-9419-433ea9e21567,2026-02-04 21:08:15.133940,People western cup maintain environment film participant effort away hotel.,10.0
d9c7a019-cf10-49bb-93b0-b364aac62b7b,d19b6284-5f7e-46cd-9419-433ea9e21567,2026-02-15 18:02:29.133940,Expert site white forward method.,5.0
ab9438ba-7eb3-42cb-bbab-2e4067325532,0faf6f85-8065-437c-b31d-26517887d647,2026-02-22 19:59:10.133940,Individual green management wind night heart popular statement which professor research war.,12.0
b820ddc7-cc71-41b0-a47c-cdf079043319,0faf6f85-8065-437c-b31d-26517887d647,2026-02-08 22:59:34.133940,Exactly capital scene north thing including respond cause since.,9.0
b5d7e8a7-f15f-4367-9f55-50d51256e976,0faf6f85-8065-437c-b31d-26517887d647,2026-02-03 21:26:58.133940,Food professor event civil effect.,5.0
0cc2e480-7e97-4eb5-8390-258795fc34bb,0faf6f85-8065-437c-b31d-26517887d647,2026-01-26 16:03:34.133940,Bring us factor star here.,5.0
c26424d9-d797-401f-bbaa-3fc3032dfcfd,0faf6f85-8065-437c-b31d-26517887d647,2026-02-16 15:02:21.133940,Word myself hospital hard.,4.0
e317f263-2357-493f-a0c2-283635faab45,0faf6f85-8065-437c-b31d-26517887d647,2026-01-27 13:10:51.133940,Green within kind collection fine.,5.0
e1ca6e80-0567-4411-a882-1a8ea2a472b5,0faf6f85-8065-437c-b31d-26517887d647,2026-01-24 23:42:49.133940,His just ago here consider safe family different show all debate off audience become hot.,15.0
e1230ced-5107-4c3f-9285-aac611e1cca6,ebc85302-4508-41e5-852a-3d7de1bd23c7,2026-02-01 16:50:27.133940,Program light prepare get.,4.0
a98fb4ec-2d5e-4fde-96dd-64084399b27e,ebc85302-4508-41e5-852a-3d7de1bd23c7,2026-01-28 16:45:46.133940,Day especially garden listen maintain quite nation dinner.,8.0
fde5371d-c845-44e2-9704-1f8e22656676,ebc85302-4508-41e5-852a-3d7de1bd23c7,2026-02-02 18:24:40.133940,Guy current station very.,4.0
5869406f-708f-4883-bbd3-90c8fed390e9,ebc85302-4508-41e5-852a-3d7de1bd23c7,2026-01-26 15:12:11.133940,Sure room this measure kid total fact.,7.0
4c9903bf-3fff-4c2c-880e-0ebca418bbc8,ebc85302-4508-41e5-852a-3d7de1bd23c7,2026-02-10 16:21:43.133940,Wait home magazine condition respond she adult well.,8.0
4ccc31e8-8e2f-49c7-a3aa-34e70054bac5,ebc85302-4508-41e5-852a-3d7de1bd23c7,2026-02-22 20:28:43.133940,Soon fall before if feel close write trial stock hundred bar.,11.0
d76b444f-87dc-4c4e-ad99-92f693389106,ebc85302-4508-41e5-852a-3d7de1bd23c7,2026-01-26 19:47:17.133940,Lose color with out effect executive fall.,7.0
12247032-9e26-499a-ae9f-7190e6dac914,481cfbff-a9e9-4a19-983d-9c7c8ee3326a,2026-02-15 15:43:29.133940,Pass former pay owner occur event human table citizen story peace detail film year.,14.0
b333c476-3712-4551-a26c-c60c34fbb2fc,481cfbff-a9e9-4a19-983d-9c7c8ee3326a,2026-01-28 17:12:18.133940,Drive language ago make gun teach successful need order travel.,10.0
ab7bc595-2e7a-4228-a592-f44cc0f69c84,481cfbff-a9e9-4a19-983d-9c7c8ee3326a,2026-02-07 22:43:08.133940,Daughter indeed firm also today action.,6.0
a42cb5ea-ddaf-4990-be79-72fa5dc89e2a,481cfbff-a9e9-4a19-983d-9c7c8ee3326a,2026-02-08 19:26:27.133940,Standard standard unit still however main man his kind item friend when democratic wonder very common off black.,18.0
0a1adcd5-e5ae-448b-b4be-f2d17c1127cc,481cfbff-a9e9-4a19-983d-9c7c8ee3326a,2026-02-08 15:49:15.134925,Recently plan all region grow floor senior field.,8.0
c687c63c-d0b3-433a-ae31-50b9b96eaa7b,481cfbff-a9e9-4a19-983d-9c7c8ee3326a,2026-02-06 22:02:05.134925,List past record our single anything single however day.,9.0
e7552ddb-c391-47cb-a279-ad4c803321ab,481cfbff-a9e9-4a19-983d-9c7c8ee3326a,2026-02-11 11:49:36.134925,Happen just vote wrong necessary fill.,6.0
d28cb722-aa30-4f1f-b7c2-a1136a7bf36d,481cfbff-a9e9-4a19-983d-9c7c8ee3326a,2026-01-25 21:07:26.134925,Resource benefit fund reveal lot computer total our station federal current leader brother science allow.,15.0
09c071e8-d167-431e-9aa2-acc37d68cd1b,762fec35-10d9-40b9-b5a6-a7c55e5c3bd8,2026-02-20 18:43:36.134925,Recognize model fast keep anyone wait trial approach under whose type.,11.0
ba6be2ed-a0ce-4408-84fc-4b4709117452,762fec35-10d9-40b9-b5a6-a7c55e5c3bd8,2026-02-10 16:16:03.134925,Throw clear each every office no visit voice west western.,10.0
4eeb4368-d5b6-4d45-97ce-da2ed53033b2,762fec35-10d9-40b9-b5a6-a7c55e5c3bd8,2026-01-24 19:39:05.134925,Weight trial seek against whose despite decade bed truth.,9.0
3cdd45dd-90f6-4396-8b99-9fa2655eb4c3,762fec35-10d9-40b9-b5a6-a7c55e5c3bd8,2026-01-29 22:59:26.134925,Director under later unit so task movie be training kind.,10.0
efc4d2bb-3849-4f9e-8eec-5780f8a7fe25,762fec35-10d9-40b9-b5a6-a7c55e5c3bd8,2026-01-24 19:37:36.134925,Chair meeting mean trial successful stock lose perhaps he course author among night role approach.,15.0
ff9b4a9e-9a90-4620-adc1-d70fff07049f,762fec35-10d9-40b9-b5a6-a7c55e5c3bd8,2026-02-19 18:07:28.134925,Maintain brother fear firm need matter kind throughout you phone food chance teach.,13.0
4775e9f1-2433-43bc-b4c4-a678d7300206,fccaf5eb-6c5b-472c-bf68-da4693626312,2026-01-31 19:20:29.134925,Five much stop involve issue case quite human away reveal east ready themselves likely although.,15.0
98405b5f-1daf-400b-8c52-e69946374997,fccaf5eb-6c5b-472c-bf68-da4693626312,2026-02-07 22:53:19.134925,Institution environmental consider treatment officer rest growth skill international cultural speech change.,12.0
746206a7-290d-4da4-b564-daf25254a0f1,fccaf5eb-6c5b-472c-bf68-da4693626312,2026-02-02 22:58:57.134925,Operation a into standard yard myself threat girl month pattern worker.,11.0
19becd4c-772a-4d87-a507-e2e745e10311,fccaf5eb-6c5b-472c-bf68-da4693626312,2026-02-21 20:35:40.134925,Special food coach foreign read whether cold professor.,8.0
4100ef9f-e996-4db3-8998-7714f50ef895,fccaf5eb-6c5b-472c-bf68-da4693626312,2026-02-12 18:01:14.134925,Watch deal who style find experience defense million recent put their bit.,12.0
b8888ae0-c2dd-4747-ad7d-ecfb250a805b,fccaf5eb-6c5b-472c-bf68-da4693626312,2026-02-04 23:31:01.134925,Likely democratic easy evening threat wonder worry level quite.,9.0
22a20bae-81b5-4e1e-b2db-21ffc20e3d40,4baa04b9-c55c-4cf8-b0ad-eb6ac54f785e,2026-02-04 23:41:02.134925,Relationship she coach visit visit when respond heart sea community attack star entire.,13.0
3762e6a7-81c2-400e-81e5-0626d8e5045d,4baa04b9-c55c-4cf8-b0ad-eb6ac54f785e,2026-02-08 22:15:23.134925,Establish surface purpose production leg detail especially.,7.0
8bd40579-f009-466d-83c5-f70f82b39bd1,4baa04b9-c55c-4cf8-b0ad-eb6ac54f785e,2026-02-09 20:51:54.134925,Decision training room than several whether.,6.0
aff1ce48-e0d1-46de-99b0-3c36da23a3cd,4baa04b9-c55c-4cf8-b0ad-eb6ac54f785e,2026-01-25 17:29:02.134925,Food player section half life.,5.0
578e6810-dcb6-401b-b0ab-e6d107ae004d,4baa04b9-c55c-4cf8-b0ad-eb6ac54f785e,2026-02-21 22:38:39.134925,Piece customer trade because increase.,5.0
d3c55f73-d22d-4560-a99a-791f02b83440,4baa04b9-c55c-4cf8-b0ad-eb6ac54f785e,2026-02-11 21:13:19.134925,Tv open field economic leg trip hundred.,7.0
df8beaed-e860-45b5-8bf2-8ba77506702b,4baa04b9-c55c-4cf8-b0ad-eb6ac54f785e,2026-02-14 21:52:26.134925,Idea show arm card wonder visit team here adult specific test.,11.0
3608cd8b-b1c3-4902-a396-d5a000417231,4baa04b9-c55c-4cf8-b0ad-eb6ac54f785e,2026-02-18 19:56:56.134925,Commercial reach glass after week item mission none result specific.,10.0
21bd5b1c-91ff-4076-82cf-a5b4862877a9,6b128278-726d-4968-8941-e352f5affe0a,2026-02-22 23:45:48.134925,Stock hot writer management realize serious miss be red public.,10.0
46e8a1cb-9194-4e99-909b-8a1a0083e62f,6b128278-726d-4968-8941-e352f5affe0a,2026-02-04 16:39:13.134925,None by fish range affect radio eye great bar.,9.0
43323020-d70a-4698-97de-22a976220cab,6b128278-726d-4968-8941-e352f5affe0a,2026-02-16 19:55:44.134925,Forward idea series alone past.,5.0
327c365e-4f15-4c60-b395-89a47ac4004c,6b128278-726d-4968-8941-e352f5affe0a,2026-01-29 18:48:28.134925,Material recognize society agency interview physical list feel sense.,9.0
9bf86071-0bcf-471d-a6d4-1fd1233a9433,6b128278-726d-4968-8941-e352f5affe0a,2026-02-15 23:42:22.134925,Shake whose first majority deep environment apply seek available bed subject son today go.,14.0
cdc2bcdb-6dd3-4614-9e02-5f81c3ecaa36,6b128278-726d-4968-8941-e352f5affe0a,2026-01-29 20:18:30.134925,President body who or computer wish father here view his election realize like toward.,14.0
ff6af357-14e9-46bb-9d74-a528cb0f8829,6b128278-726d-4968-8941-e352f5affe0a,2026-02-17 18:08:53.134925,For interesting heavy middle.,4.0
710e9dfa-79ce-4207-83a0-9fe20f1c7405,6b128278-726d-4968-8941-e352f5affe0a,2026-01-27 19:38:39.134925,Prove real evening mission itself interesting to game by hotel.,10.0
2930e3b6-1e2e-4d32-a715-296013220143,4486f098-4de9-4c0f-b85c-f8d9b0ea772d,2026-02-04 19:54:53.134925,Skill small ability ability fill community list company share six purpose home line.,13.0
28960bd2-d67a-447c-aadd-6d4f34ba632e,4486f098-4de9-4c0f-b85c-f8d9b0ea772d,2026-02-17 17:29:17.134925,Yeah sort measure despite top back surface miss keep.,9.0
a540fa5b-3dad-4791-ac67-b23eeaa726f6,4486f098-4de9-4c0f-b85c-f8d9b0ea772d,2026-02-03 18:57:15.134925,Than anything over technology service establish.,6.0
4780ce64-8614-437a-a4c6-b0ec09328076,4486f098-4de9-4c0f-b85c-f8d9b0ea772d,2026-02-08 15:18:31.134925,Little indeed each indeed fly officer tough there industry than describe white budget maybe.,14.0
1a50564e-94ae-473f-b2ff-ee180af59506,259cff8b-f4da-481f-9f87-4610526c25f3,2026-01-28 13:03:26.134925,Perform performance mother rate cost.,5.0
110bc8a3-50d7-4ac7-bc41-6dcbf58576a9,259cff8b-f4da-481f-9f87-4610526c25f3,2026-01-28 23:02:44.134925,Base economic identify agreement administration rise by could crime positive.,10.0
2e674a52-a87e-4998-934d-b0fafdd49669,259cff8b-f4da-481f-9f87-4610526c25f3,2026-01-27 20:17:09.134925,Know collection move it hour natural trouble information myself tough stock while rock parent.,14.0
273ca4d5-1ec6-467b-b16c-1f762e275d05,26a0bbab-b450-4ac6-87b2-0c8c4a53e16b,2026-02-03 19:51:34.134925,Night form arm cold rate know special history east say morning article property.,13.0
dccbbdcc-b470-4fb4-bbf1-f3b98730540d,26a0bbab-b450-4ac6-87b2-0c8c4a53e16b,2026-02-21 20:43:28.134925,Water third thank receive even difficult hospital effect film anything reason carry result American own list.,16.0
0e7e76a4-9ba4-4f0e-8936-769b261de0ba,26a0bbab-b450-4ac6-87b2-0c8c4a53e16b,2026-01-28 23:59:33.134925,Much himself sit court tell or none better say two should than both safe pick.,15.0
b967ff8d-dd59-4783-a40e-fed1d04466cd,26a0bbab-b450-4ac6-87b2-0c8c4a53e16b,2026-01-26 15:08:15.134925,Order alone watch leave each movie still fight appear yourself.,10.0
0fb20b16-1e5b-47ca-9d21-9a21f917900a,26a0bbab-b450-4ac6-87b2-0c8c4a53e16b,2026-02-23 20:05:46.134925,War federal be performance technology air.,6.0
1e59dbe0-07b5-4019-92a0-8dd370cfffea,26a0bbab-b450-4ac6-87b2-0c8c4a53e16b,2026-02-18 19:53:52.134925,Wind evidence available impact fire catch skill budget.,8.0
7c2d2567-9383-4094-b013-59479ec16ea5,26a0bbab-b450-4ac6-87b2-0c8c4a53e16b,2026-02-03 19:38:31.134925,All to hit open thus none citizen clear positive foot it put some personal.,14.0
8d65e141-b809-4d50-9156-7ae31bf6b300,26a0bbab-b450-4ac6-87b2-0c8c4a53e16b,2026-02-23 19:06:38.134925,Five memory behavior this special eye stop.,7.0
8b56e3a6-3748-4a89-99bc-cc67a579f1da,62ce16f3-3654-49a8-b150-0adce6a95f97,2026-02-09 22:11:39.134925,Audience better young next traditional evening bill reason.,8.0
e0320842-0750-403d-b99a-a6741857f601,62ce16f3-3654-49a8-b150-0adce6a95f97,2026-02-04 13:10:51.134925,Job information responsibility such benefit tend control employee tough environment hospital.,11.0
5a919414-8977-4831-be9d-2d7e2416423b,62ce16f3-3654-49a8-b150-0adce6a95f97,2026-02-08 19:06:03.134925,Pattern east arrive company quickly involve foot people begin realize international.,11.0
b20f0692-6cd5-4c01-b482-3de581e43b61,62ce16f3-3654-49a8-b150-0adce6a95f97,2026-01-27 21:46:02.134925,North ground too owner gun trial start try else majority strategy capital interesting however former enough.,16.0
d4297244-c2d5-4bb6-8669-7dc6793704b9,6a5ebd1b-c67a-472f-af8d-d76a0c95cb16,2026-01-31 22:14:14.134925,Building sometimes since material other green much.,7.0
7cfb7520-5486-4f9b-bc57-723c075c9683,6a5ebd1b-c67a-472f-af8d-d76a0c95cb16,2026-02-10 18:38:58.134925,Option peace indeed least skin last sister debate.,8.0
