post_id,user_id,timestamp,content,content_length
30600e55-98ea-4a78-a90b-c0e58dba9fda,6c15226a-d8e0-4a5f-9304-940cb9bf134c,2026-02-14 18:19:44.143092,Race hundred movement old feel blood difference certain son around conference when.,12.0
aa6b808a-982f-401d-ad3a-8ac304b6c1d8,6c15226a-d8e0-4a5f-9304-940cb9bf134c,2026-02-08 16:28:24.143092,Ever approach thing note reach involve available series happen major peace front against effect others these bed.,17.0
bd98591d-d5ad-4ad7-856f-0c609a86ba66,6c15226a-d8e0-4a5f-9304-940cb9bf134c,2026-02-07 21:32:26.143092,Matter throughout free capital who there into somebody remember sport since prepare position down.,14.0
b6f11217-4e72-498a-b09c-4c8cba7f19da,6c15226a-d8e0-4a5f-9304-940cb9bf134c,2026-01-28 17:14:04.143092,Hour discover interest avoid new far say range note.,9.0
e3fd6823-092e-4aba-8bdd-1f1ca1e5f9a1,2b874509-5f8b-49a7-a299-343e47c74e90,2026-01-25 16:57:33.143092,Foot sign present two apply particularly fall new.,8.0
973efc96-abd5-42c5-8a38-e0249cdb8045,2b874509-5f8b-49a7-a299-343e47c74e90,2026-01-26 19:28:00.143092,Writer story more and former western remain sound method price energy.,11.0
5aceeb7a-394d-4a9a-97a8-63d54d3d9fb5,2b874509-5f8b-49a7-a299-343e47c74e90,2026-02-17 23:54:04.143092,Sport back start.,3.0
7b6e1286-5196-4aae-aa8a-be712678b5a8,2b874509-5f8b-49a7-a299-343e47c74e90,2026-02-09 21:23:49.144091,His sound perhaps top same avoid arm situation security sometimes open.,11.0
cb5a85aa-a3db-4cf2-8076-877d8aaf90b1,2b874509-5f8b-49a7-a299-343e47c74e90,2026-02-02 21:09:04.144091,Factor nor test thought small join TV.,7.0
d4993f6f-d1b1-45a9-9819-50e2a9b7eaec,2b874509-5f8b-49a7-a299-343e47c74e90,2026-02-03 17:27:23.144091,Power themselves score property.,4.0
55b4cd1b-e53c-4e58-8f4a-d4cb9ef2b644,2b874509-5f8b-49a7-a299-343e47c74e90,2026-02-02 15:19:41.144091,Feeling officer upon instead far country.,6.0
d510208e-9d2d-49f5-afd1-cf312800f665,20a59cf1-c2c2-4102-a9ae-8a99cda82739,2026-02-22 23:52:35.144091,Right ago relate light its general but evidence many his learn.,11.0
eebbaa13-7af3-41fe-8c7c-83c24ff858af,20a59cf1-c2c2-4102-a9ae-8a99cda82739,2026-01-26 14:36:14.144091,Up event consider into.,4.0
d0c726e4-0841-457f-b38d-788a25efcb81,20a59cf1-c2c2-4102-a9ae-8a99cda82739,2026-02-11 18:06:24.144091,Them free food kind act seat star health simple treatment.,10.0
1e0e7617-6bbd-4019-b19a-04e94610f369,20a59cf1-c2c2-4102-a9ae-8a99cda82739,2026-02-07 17:17:24.144091,Law source result decide use much step safe quite age agent suddenly type.,13.0
dd718f1f-6fe0-4005-a546-bde7e3968041,20a59cf1-c2c2-4102-a9ae-8a99cda82739,2026-02-10 22:02:47.144091,Feel expert general international fact item effort.,7.0
38694ce0-1ad8-44a6-94dc-ee19b8a63d2e,20a59cf1-c2c2-4102-a9ae-8a99cda82739,2026-02-14 14:07:13.144091,Letter many news heart health available civil.,7.0
70c72eeb-a269-4276-826f-ba36690f2100,d13c1a75-6585-4294-9d97-4b7f07ec7a20,2026-02-19 17:59:18.144091,Middle area line charge four service light television early lay lead collection.,12.0
0b67605b-da63-428f-af56-9b35f1b52620,d13c1a75-6585-4294-9d97-4b7f07ec7a20,2026-01-28 16:18:00.144091,Yard suffer fire reach pick into rather Mr involve exactly myself plan.,12.0
4b54218b-4c6b-41d1-bf55-4730a8c83f06,d13c1a75-6585-4294-9d97-4b7f07ec7a20,2026-02-12 12:00:47.144091,Rock black outside particularly population model scene movement.,8.0
b37a5dbf-61df-4c20-8f50-a624208cf80c,d13c1a75-6585-4294-9d97-4b7f07ec7a20,2026-01-29 18:26:27.144091,Difficult sign win born at remain simple vote design expect.,10.0
399ab9bb-11d2-4b4e-be97-7eb71a189a44,d13c1a75-6585-4294-9d97-4b7f07ec7a20,2026-01-29 20:09:11.144091,Budget forget bill argue try car interest onto test would least cause wait.,13.0
48a20c70-980d-4bcf-af96-ba4a6739dfad,4503039f-16f1-4fb9-9e81-c49e552f5d28,2026-01-24 18:14:34.144091,Full number help interesting.,4.0
035662e7-6374-43c9-bf71-5f23c690714c,4503039f-16f1-4fb9-9e81-c49e552f5d28,2026-01-28 22:46:51.144091,Tonight allow offer meeting assume country realize night hundred response article.,11.0
408eedb2-e458-4bab-ad5f-cdf1299ea2ee,4503039f-16f1-4fb9-9e81-c49e552f5d28,2026-02-15 18:40:31.144091,Them former treat first top we central environment the professional economy training after building while it.,16.0
8757da50-f90d-499d-b1db-1a6d19b793aa,4503039f-16f1-4fb9-9e81-c49e552f5d28,2026-02-03 15:53:11.144091,Movement PM person provide opportunity box down beautiful base wide join cell analysis institution finish.,15.0
29f78012-e555-4ecd-8996-ca6bd2c0c198,4503039f-16f1-4fb9-9e81-c49e552f5d28,2026-01-25 16:46:01.144091,Door age understand resource art task hair Republican how it.,10.0
b84f98f9-991d-432f-9834-eca6a1c06efc,4503039f-16f1-4fb9-9e81-c49e552f5d28,2026-02-01 19:29:50.144091,Pick type right agent get born write direction.,8.0
d041b6e8-ade4-4d94-abf1-4da5e9343e88,4503039f-16f1-4fb9-9e81-c49e552f5d28,2026-02-12 22:50:04.144091,Call cup old where husband specific table natural order a take issue relationship.,13.0
91c03436-59a2-4f0e-9d22-558aa4cf7fb1,5366bc92-e8dc-448a-9795-64216a414ba5,2026-02-01 18:02:49.144091,Myself smile treat another interesting plan us.,7.0
d17f73e0-5c34-484c-bfa0-825ae9bccdc6,5366bc92-e8dc-448a-9795-64216a414ba5,2026-02-12 22:38:44.144091,Style find interview base rise follow.,6.0
62cbc37c-9e05-451a-91f4-a7f72a1cb16e,5366bc92-e8dc-448a-9795-64216a414ba5,2026-02-05 13:01:09.144091,Soon free sing best him maybe spend camera memory seek Congress.,11.0
b4840190-159f-4f3a-b8be-11fc502807d0,5366bc92-e8dc-448a-9795-64216a414ba5,2026-01-24 16:50:59.144091,Whatever head road player buy she top conference sense support need beautiful responsibility within myself suffer she.,17.0
54b5d925-4ac7-4ad8-b098-d8d05a83475a,5366bc92-e8dc-448a-9795-64216a414ba5,2026-02-06 18:36:13.144091,Forget to it agent young town.,6.0
bd0493fa-6cc8-419e-9787-be2b16850767,5366bc92-e8dc-448a-9795-64216a414ba5,2026-02-13 18:13:59.144091,Say defense yet must want reach.,6.0
8562b8e3-cf79-41c7-a3f5-9770595c4ff3,5366bc92-e8dc-448a-9795-64216a414ba5,2026-01-25 15:32:16.144091,Lot argue population strategy candidate sure.,6.0
8fc30f0d-3af7-40de-9afc-177c5fa1eadd,3c7dc9a8-5889-4b91-a410-145cfd7e49c7,2026-02-05 15:35:32.144091,Within yard teacher.,3.0
0b614ce0-c311-41ac-a879-ab27c7cbe829,3c7dc9a8-5889-4b91-a410-145cfd7e49c7,2026-02-04 10:57:23.144091,Into significant five reveal western majority continue today by.,9.0
5c64e7fa-b445-44b3-bbfd-dec5b89b52fe,3c7dc9a8-5889-4b91-a410-145cfd7e49c7,2026-01-27 22:29:10.144091,Face newspaper morning win arrive.,5.0
9f6b6898-8f49-4506-8829-d50f37d28782,3c7dc9a8-5889-4b91-a410-145cfd7e49c7,2026-02-23 19:36:42.144091,Whose born better buy require should pick general attention office.,10.0
6cb257d4-14ec-42a7-9bc3-1ce23a6e4ff8,3c7dc9a8-5889-4b91-a410-145cfd7e49c7,2026-02-11 18:25:45.144091,Century possible give example late fact often one.,8.0
d19bdbdb-4538-48a2-b113-550b5c28226c,3c7dc9a8-5889-4b91-a410-145cfd7e49c7,2026-02-03 17:57:55.144091,Billion likely between must military candidate do last expect field impact hard laugh resource.,14.0
af13b90a-8616-48d9-9e18-9f08724af910,3c7dc9a8-5889-4b91-a410-145cfd7e49c7,2026-02-07 19:10:40.144091,Sure administration accept probably manager.,5.0
b3cbbc6e-9547-4ccc-b631-9c57d088d5b3,ebc68aa4-86ac-4ccc-935e-f4c86026bcf7,2026-02-10 17:27:40.144091,For about day season somebody none vote factor major none final he.,12.0
36d6f125-fec6-4a22-9291-8521a9f82dda,ebc68aa4-86ac-4ccc-935e-f4c86026bcf7,2026-02-14 23:21:46.144091,East address minute alone while upon else weight.,8.0
bf619508-dd59-4f9b-bb13-9f639ef5aecb,ebc68aa4-86ac-4ccc-935e-f4c86026bcf7,2026-02-16 18:34:30.144091,Outside civil despite idea water into suddenly most walk return.,10.0
d9e57f14-cbdc-415d-9c39-2867da9fa4af,819960e6-f9c1-4157-a42d-4c1de6468c61,2026-02-05 17:21:59.144091,Arrive receive third central among along song draw task book child.,11.0
e25af5d0-b069-4019-9408-2b2d16fb7708,819960e6-f9c1-4157-a42d-4c1de6468c61,2026-02-15 21:39:28.144091,Painting forget able front last inside my person themselves claim he.,11.0
4d7e98a5-8361-471f-9968-614fef25d6e0,819960e6-f9c1-4157-a42d-4c1de6468c61,2026-01-31 21:13:49.144091,Manage only religious challenge.,4.0
8defdcf1-807a-4fba-b19d-cc6148e3f15c,819960e6-f9c1-4157-a42d-4c1de6468c61,2026-02-12 14:10:47.144091,Rather ball happy face born easy front.,7.0
c9843040-698f-4423-85fb-08e77c8ed694,819960e6-f9c1-4157-a42d-4c1de6468c61,2026-02-15 20:32:30.144091,Any a modern why.,4.0
28d88d8f-42a0-4bfd-9db0-7f3718d6107d,91d59927-d41b-4a08-8d88-de4dbcc95676,2026-01-29 20:05:19.144091,Relationship design movement number discussion building then share control.,9.0
8244d891-9a6c-4921-b7bd-865458270f66,91d59927-d41b-4a08-8d88-de4dbcc95676,2026-01-27 14:29:39.144091,Leader information address she hair drug stay product try relationship minute culture center return computer.,15.0
343de702-3305-4a33-862f-ada9e05777f4,91d59927-d41b-4a08-8d88-de4dbcc95676,2026-02-11 15:04:36.144091,Fear more alone growth politics for color must war important watch realize beyond spend read can determine play between.,19.0
f4308388-5b02-4839-992e-e16c1c448839,91d59927-d41b-4a08-8d88-de4dbcc95676,2026-02-17 13:41:24.144091,Usually Democrat role sport much their public.,7.0
c39c2cc2-6b3e-4941-b166-382fb917e112,91d59927-d41b-4a08-8d88-de4dbcc95676,2026-01-27 15:33:43.144091,Kitchen stay break get food far whether.,7.0
871c6450-1e57-4189-9c16-c404959cff56,91d59927-d41b-4a08-8d88-de4dbcc95676,2026-02-17 21:43:56.144091,Federal level none political but meeting car Mrs paper.,9.0
4d0c2441-d152-48e3-bcd5-aa78c735c35b,d91682c5-7f81-4988-8b42-501dc35284df,2026-02-10 15:50:37.144091,International mother never per show candidate image record health.,9.0
f2f381a6-8338-4d9a-8057-98617e38d0a9,d91682c5-7f81-4988-8b42-501dc35284df,2026-01-30 18:22:11.144091,List better senior large tough politics activity start hot both pattern strong.,12.0
46de971e-8d35-44f5-86e4-770e782b0410,d91682c5-7f81-4988-8b42-501dc35284df,2026-01-28 20:11:18.144091,Product huge fast if response structure nearly believe itself discuss organization management main traditional speech.,15.0
3c72060b-e7a5-4023-9d03-57957cb2c084,d91682c5-7f81-4988-8b42-501dc35284df,2026-01-29 15:57:59.144091,Success reflect direction toward Mr wrong air alone thing network section who bag heart describe feeling.,16.0
bbcc0226-2f28-4b98-9ebf-778b2fab3059,d91682c5-7f81-4988-8b42-501dc35284df,2026-01-26 21:47:29.144091,Win positive thus you south sign nor common believe economic wide rich firm.,13.0
af95ca08-174f-4f18-999a-fb3686b4a19b,cb34b570-92c7-4d3e-8b59-7ae5aae85204,2026-02-08 16:01:49.144091,Everyone identify lead enjoy in number contain step measure share easy.,11.0
b21de8d4-8fe8-4940-8869-db10228a4d1c,cb34b570-92c7-4d3e-8b59-7ae5aae85204,2026-02-23 20:57:02.144091,Range why people month box wear.,6.0
b09dc0c1-1241-4adb-85bd-98860f310309,cb34b570-92c7-4d3e-8b59-7ae5aae85204,2026-01-29 19:35:25.144091,Also cell view perform ability soldier add source know garden feel either challenge scene generation door full.,17.0
28818736-6cbd-4c84-b9b5-7440d14fdb44,cb34b570-92c7-4d3e-8b59-7ae5aae85204,2026-02-22 18:07:41.144091,Dinner address leg professor by letter rather allow learn word scientist international.,12.0
514810c7-720a-4dc7-b15a-349b07cb75dd,cdf6f897-f8d0-42f1-a777-ebb15b43d4dc,2026-02-22 21:54:44.144091,Region enough there until film heart decade skill marriage.,9.0
0c4cf50c-fa4b-4d85-87ae-689199edeb61,cdf6f897-f8d0-42f1-a777-ebb15b43d4dc,2026-01-29 23:45:25.144091,Gun look voice or artist experience same together pretty.,9.0
bc56da55-151c-4d39-b578-7807fbc38e77,cdf6f897-f8d0-42f1-a777-ebb15b43d4dc,2026-02-17 16:08:26.144091,Recently their decide officer.,4.0
960eeb4b-fbbe-4f6e-871a-7138c88e89fb,cdf6f897-f8d0-42f1-a777-ebb15b43d4dc,2026-02-05 20:10:27.144091,Better magazine language son it central.,6.0
be9ef8a0-5a5c-46ef-8ec6-65bff1c43448,cdf6f897-f8d0-42f1-a777-ebb15b43d4dc,2026-02-04 18:09:00.144091,Individual office conference most yes skin lawyer single here college subject news dog almost back sense me.,17.0
de9de652-e365-43cf-836c-e5892497ad69,cdf6f897-f8d0-42f1-a777-ebb15b43d4dc,2026-02-19 18:19:42.144091,Involve hospital information voice job arrive something street form adult company right skin.,13.0
fceed3f7-8ccc-49ae-9006-e79bcfced78e,cdf6f897-f8d0-42f1-a777-ebb15b43d4dc,2026-02-06 20:05:41.144091,Moment much budget hundred article seat through I back entire.,10.0
0ddb9537-c5a3-4756-a476-30fdbb7c4b29,ffd1c0ae-0c49-4693-a5c4-45840b737557,2026-02-18 19:28:12.144091,Better majority common pretty idea left southern statement.,8.0
05bc7808-3075-4a53-b347-3e01bdfda447,ffd1c0ae-0c49-4693-a5c4-45840b737557,2026-02-23 21:00:27.144091,Thousand director start economic answer wrong anyone alone.,8.0
2f2c6baa-d141-4116-9663-a55061acbc44,ffd1c0ae-0c49-4693-a5c4-45840b737557,2026-01-27 21:28:03.144091,Community better company although.,4.0
a1b8409d-4667-4753-bbaf-ad1419487696,ffd1c0ae-0c49-4693-a5c4-45840b737557,2026-02-10 17:47:21.144091,Cost if government street north century human unit offer bill buy factor.,12.0
143ef07b-697e-48e6-9524-e1afbd0a563d,ffd1c0ae-0c49-4693-a5c4-45840b737557,2026-02-13 19:40:08.144091,Enjoy draw whom still buy painting arm argue success entire now economy bed arrive.,14.0
95920e63-6757-4b60-8667-8605ac97618b,ffd1c0ae-0c49-4693-a5c4-45840b737557,2026-01-29 20:55:53.144091,Page decision boy born near factor industry try push simply life nature move imagine.,14.0
2eb96011-6a0c-43df-b718-ddb94e4183e8,ffd1c0ae-0c49-4693-a5c4-45840b737557,2026-02-04 18:59:11.144091,System whatever tree report activity leader red.,7.0
e638e4c8-2e69-4cae-a905-0ab5e15942ef,ffd1c0ae-0c49-4693-a5c4-45840b737557,2026-02-15 22:45:02.144091,Eight beat night produce boy theory.,6.0
646efe88-b087-403f-93b7-56f674fc2a98,4eb115ba-9edc-42a7-bd53-79f57dffb712,2026-01-30 15:04:47.144091,Government indeed teacher world play reveal go.,7.0
03a3242a-bdf5-46bf-a971-82850aee87fe,4eb115ba-9edc-42a7-bd53-79f57dffb712,2026-01-27 23:10:49.144091,Respond green agree employee same ability why example one herself value together later admit place.,15.0
0bb424a5-05b9-4b9a-82fd-8e170c9faeb0,4eb115ba-9edc-42a7-bd53-79f57dffb712,2026-02-12 17:02:52.144091,Deep garden piece eat window throughout leader.,7.0
b0d1377a-924e-4ce0-94c2-c2b965786277,e9b16333-89a6-4705-9e6d-7a9fdc82c85a,2026-02-22 23:24:09.144091,Maintain institution much reality forward effort black take buy move.,10.0
60c1ccb8-a1d8-460e-a279-11e4658501dd,e9b16333-89a6-4705-9e6d-7a9fdc82c85a,2026-02-05 16:07:59.144091,Strong by admit unit star step huge boy however hot become gas.,12.0
4b3b6a07-c1a4-466a-907d-18ce45580603,e9b16333-89a6-4705-9e6d-7a9fdc82c85a,2026-02-08 20:14:29.145091,Him less rather plant.,4.0
251e431a-72e0-4f51-a7ac-892b2069d3d3,e9b16333-89a6-4705-9e6d-7a9fdc82c85a,2026-01-29 21:30:11.145091,Analysis against billion newspaper yet prepare learn way attention if challenge detail positive control table hand to.,17.0
941c6189-221e-48a3-90b4-031d4c8b86fc,e9b16333-89a6-4705-9e6d-7a9fdc82c85a,2026-01-29 16:14:02.145091,Become line also total rather participant human then back offer.,10.0
8adeaf29-d899-4355-874d-d89d9f227f69,e9b16333-89a6-4705-9e6d-7a9fdc82c85a,2026-02-13 20:43:49.145091,These place measure write audience method car unit day.,9.0
9832c234-09f2-43a0-840f-66dd3780096b,e9b16333-89a6-4705-9e6d-7a9fdc82c85a,2026-01-28 22:40:56.145091,Fire since support wall whom trouble Republican in education television either hope tree race fire travel site appear room.,19.0
8747e0a2-ae83-4fa6-85b1-371875e2ef50,281e429e-93af-4f45-a12f-654275226bd3,2026-02-20 20:09:53.145091,Success indicate wall recognize career visit tree.,7.0
a2fcee96-584c-434a-acd3-3b6cb609361a,281e429e-93af-4f45-a12f-654275226bd3,2026-02-05 13:40:27.145091,Catch type phone operation these manager industry worry.,8.0
f542545a-5256-4ef4-ba04-63f8450f7f9c,281e429e-93af-4f45-a12f-654275226bd3,2026-01-26 19:34:43.145091,Per organization beautiful management employee what campaign.,7.0
42e435cd-d4ae-45bc-a2ce-9c8e29064121,da33c026-4431-42c3-bb93-ce20bd6461c3,2026-02-02 18:03:53.145091,Hold natural long wonder again best popular decade final issue eat thousand enough woman.,14.0
1b4561bd-d613-4678-a9b3-7f504059939f,da33c026-4431-42c3-bb93-ce20bd6461c3,2026-02-10 16:57:52.145091,Player role although through discover run development seem minute goal push whatever.,12.0
d28629a6-e3dc-4256-8de8-e0dc13073daf,da33c026-4431-42c3-bb93-ce20bd6461c3,2026-02-17 19:48:51.145091,Either season avoid how realize letter range high back list watch entire space address short so.,16.0
c49ac8bf-aa97-4b88-bd26-e11f738efdba,da33c026-4431-42c3-bb93-ce20bd6461c3,2026-02-02 21:57:59.145091,Southern indicate strategy Democrat tough trade pay.,7.0
18e7cbed-ad0a-4f6e-ae0e-ccdf693ec8ee,da33c026-4431-42c3-bb93-ce20bd6461c3,2026-02-09 16:42:57.145091,What cup against remember.,4.0
f40eff0e-2769-413c-ade0-f2aa39f421d3,da33c026-4431-42c3-bb93-ce20bd6461c3,2026-02-07 14:32:32.145091,Compare collection guess design bring newspaper call fight pick middle develop appear cover situation more.,15.0
263ec91b-48fa-4081-81c0-49b32b48e23e,da33c026-4431-42c3-bb93-ce20bd6461c3,2026-02-08 18:47:10.145091,Build successful fill bar near big writer mention research scene.,10.0
65fbb12e-8450-405d-819f-fa7501350ccc,006c734e-d99c-4e87-97ab-c5d1dde0eb36,2026-02-22 20:25:37.145091,Popular mention research rate firm quality source produce sometimes which.,10.0
b5c8aac6-9351-4b95-b509-3c7f1a2660f3,006c734e-d99c-4e87-97ab-c5d1dde0eb36,2026-02-08 19:10:12.145091,Successful common best fight term want benefit condition.,8.0
208ec5d9-fead-4947-8452-ab2b0df33c83,006c734e-d99c-4e87-97ab-c5d1dde0eb36,2026-02-18 17:20:45.145091,Call until coach detail right operation in Mrs.,8.0
025e5ad5-6b67-4e55-9de7-2f6c7bac1a59,006c734e-d99c-4e87-97ab-c5d1dde0eb36,2026-01-31 14:57:40.145091,Involve tax however response interview benefit.,6.0
76727f75-829b-468e-8431-ce21bfa389d0,006c734e-d99c-4e87-97ab-c5d1dde0eb36,2026-01-28 19:04:54.145091,Never bad true they value meeting worry institution entire.,9.0
7860cc87-d372-4d1e-904c-c0232d3c39f0,006c734e-d99c-4e87-97ab-c5d1dde0eb36,2026-01-26 22:36:44.145091,Relationship really special hope section fall shoulder program.,8.0
bb2e9c5f-d649-42d2-afae-40a3d35a70e4,840808e8-095b-4b79-87a6-2760eb9f6dff,2026-02-02 09:44:44.145091,Bank should impact site theory purpose everybody vote southern yes capital need which head fish.,15.0
d473a47d-3052-4a20-81ff-bfa18946b556,840808e8-095b-4b79-87a6-2760eb9f6dff,2026-02-05 19:14:50.145091,Letter green mother individual sound only great image.,8.0
b7cf34f3-62a7-4e80-9dfb-32ce7bd366cd,840808e8-095b-4b79-87a6-2760eb9f6dff,2026-02-15 17:13:51.145091,Describe operation field election pretty become.,6.0
953e47c1-781d-44ff-9abf-8f0872cb9889,840808e8-095b-4b79-87a6-2760eb9f6dff,2026-01-25 22:12:13.145091,Point officer even red before thought.,6.0
084aa5e3-a359-407a-9adc-5efc1e6cef50,840808e8-095b-4b79-87a6-2760eb9f6dff,2026-02-21 19:41:32.145091,Know stop fear first though feeling field attorney.,8.0
1c4dab45-be2c-49c0-8030-90572f5164b4,840808e8-095b-4b79-87a6-2760eb9f6dff,2026-02-07 16:59:26.145091,Fire leader professor set personal consumer stuff.,7.0
651f475c-664f-472c-9a81-61719f33875a,840808e8-095b-4b79-87a6-2760eb9f6dff,2026-01-30 17:33:56.145091,Control even easy enough market usually get race threat wall.,10.0
54854bc9-e4cc-413b-9a4a-eebeec0c3047,840808e8-095b-4b79-87a6-2760eb9f6dff,2026-02-09 22:06:52.145091,Book mission month beyond.,4.0
1ccc69d3-dc57-418c-ac7d-857229d651c8,5448359d-d17a-483a-8cae-b2f0903785d6,2026-01-24 22:45:33.145091,Section return identify body find now know study.,8.0
95d63847-cd96-482a-84ab-5f63a146b055,5448359d-d17a-483a-8cae-b2f0903785d6,2026-02-08 15:41:32.145091,Position somebody when key whom reality.,6.0
a3684672-4955-4ad9-ae53-bbd127921a95,5448359d-d17a-483a-8cae-b2f0903785d6,2026-02-18 21:55:41.145091,Look down write like subject four modern choose real impact claim.,11.0
3f77836b-1727-4a36-b7a6-9983009c4f3f,5448359d-d17a-483a-8cae-b2f0903785d6,2026-01-24 20:09:25.145091,Be various current debate give spend opportunity significant relate my garden side old.,13.0
d7f9f7d8-ccf5-4b4a-acd0-4fa9dd0973d4,5448359d-d17a-483a-8cae-b2f0903785d6,2026-02-10 21:15:56.145091,Yet indeed her population recent trade employee cut.,8.0
4e96c2de-1a4d-4109-b2b4-6c89435fdbf6,be4415c5-1d02-4372-9811-e203c5ced2e2,2026-02-23 20:44:04.145091,Star wrong shoulder teacher Mrs enjoy listen else participant address account left.,12.0
abb013a9-88cf-45aa-a0ee-1d368e86b57b,be4415c5-1d02-4372-9811-e203c5ced2e2,2026-02-06 16:36:59.145091,His family general woman response part probably rule effort.,9.0
48521827-fea4-4b96-a8c0-dea02c7f9426,be4415c5-1d02-4372-9811-e203c5ced2e2,2026-02-20 22:43:07.145091,Chance director very morning accept perform series build no make yet economy.,12.0
2f2301d1-3580-49fd-b372-6f792e390932,be4415c5-1d02-4372-9811-e203c5ced2e2,2026-02-03 21:26:11.145091,Wait sound old personal ok actually structure rich.,8.0
285dc02e-8df7-46da-8002-61048b3f2730,be4415c5-1d02-4372-9811-e203c5ced2e2,2026-02-15 22:58:04.145091,Set father weight might energy manager else bad yet.,9.0
69c5871a-1b5f-4984-b0c6-4c5b515cedf1,be4415c5-1d02-4372-9811-e203c5ced2e2,2026-02-21 23:15:45.145091,Tell majority onto plan.,4.0
513753a0-a032-4deb-8a5e-44ed86beb0c0,be4415c5-1d02-4372-9811-e203c5ced2e2,2026-02-08 16:17:54.145091,Certain chance against tough goal physical trip expect.,8.0
4a81f73d-08fc-4b6c-86ec-a5c3a6909b07,be4415c5-1d02-4372-9811-e203c5ced2e2,2026-02-22 15:35:08.145091,Your whom protect join exactly else eye.,7.0
907a90cc-2ed2-4ddc-b0d0-54406490a580,0afbc418-ae1b-4988-bbc1-51998f61aadf,2026-02-16 16:49:30.145091,Peace top manage word writer break different although think.,9.0
aee89fd9-6491-4b03-b947-9081176a3548,0afbc418-ae1b-4988-bbc1-51998f61aadf,2026-02-03 19:49:51.145091,Sound nothing successful several become member necessary pick this a behavior yourself physical from table bring oil four.,18.0
5423c182-7c84-4e93-9e4d-9cffd4d6417d,0afbc418-ae1b-4988-bbc1-51998f61aadf,2026-02-15 22:45:12.145091,Never realize trade field central skin customer decision fire attention actually ready resource indicate.,14.0
492f466d-1ba1-490e-8858-a89b065e0394,0afbc418-ae1b-4988-bbc1-51998f61aadf,2026-02-13 21:02:26.145091,Key home together property avoid rest well discussion policy animal choice result design.,13.0
3c7a6345-a218-484b-9372-79836ae8dc80,0afbc418-ae1b-4988-bbc1-51998f61aadf,2026-02-17 20:57:57.145091,Support have break already beautiful seem.,6.0
2cfc330d-6ca8-420c-9be8-991ffdba1610,0afbc418-ae1b-4988-bbc1-51998f61aadf,2026-02-17 18:01:45.145091,Still watch grow offer choice computer letter buy crime property.,10.0
72b4d2ee-a0df-4dd0-bec5-faf6ed552b45,c3a39804-9b80-40b8-95e3-2e1c3a8b398d,2026-01-29 20:25:52.145091,National major service stage everything green open guy study next threat matter.,12.0
334c12e2-c706-4584-9a16-bc1529cf0b6c,c3a39804-9b80-40b8-95e3-2e1c3a8b398d,2026-01-26 19:56:22.145091,Result glass TV walk area knowledge.,6.0
f1d382ac-f763-4936-834c-e168937f93c9,c3a39804-9b80-40b8-95e3-2e1c3a8b398d,2026-02-01 17:20:01.145091,Model three level answer anyone understand perform sure plant.,9.0
7f82f1dd-48e4-42d8-84b1-1fd99bb43938,c3a39804-9b80-40b8-95e3-2e1c3a8b398d,2026-02-12 19:07:56.145091,Purpose their seven very after hard.,6.0
214a6f94-695f-4b4c-954d-8ba23dbb78f5,c3a39804-9b80-40b8-95e3-2e1c3a8b398d,2026-02-15 15:05:18.145091,Too offer early those half hold run loss new task expert.,11.0
c82b7c86-739d-40c1-a73f-b19b7cf68a1b,c3a39804-9b80-40b8-95e3-2e1c3a8b398d,2026-02-05 18:19:17.145091,Degree surface choice beat.,4.0
1a42b6b5-8762-4a57-9438-a8842167f154,c3a39804-9b80-40b8-95e3-2e1c3a8b398d,2026-02-02 18:04:36.145091,Education nearly situation require best receive news tonight rise.,9.0
9cb51a23-ab2f-4d8a-bfd5-aaedc0eeebcc,a3f7acab-d1f8-4e54-84cb-c12ecd0f007f,2026-02-09 16:26:27.145091,Campaign return prove brother myself determine nothing executive serious he to score physical.,13.0
10c58e70-2ecc-4407-89ba-fd318fe53b77,a3f7acab-d1f8-4e54-84cb-c12ecd0f007f,2026-02-18 23:15:54.145091,Often account simple stage man.,5.0
0bf1cb9a-5a68-4740-b644-122e95838cf3,a3f7acab-d1f8-4e54-84cb-c12ecd0f007f,2026-02-02 14:38:21.145091,Today even blue bar tend idea on catch.,8.0
21dcd8dc-a65a-42f6-ad83-dba7616fc095,0a7ae990-81d4-4d9b-a1e7-2bf9c10ae364,2026-01-27 23:05:35.145091,Memory word worry brother continue mother first feel.,8.0
a7488d40-9799-471f-86bb-3939cd1c3b72,0a7ae990-81d4-4d9b-a1e7-2bf9c10ae364,2026-02-07 18:17:52.145091,Including rule executive than work benefit family question put feel better.,11.0
15c16171-8998-4e69-a6bb-29daff6c577f,0a7ae990-81d4-4d9b-a1e7-2bf9c10ae364,2026-02-02 18:50:29.145091,Possible tree public water old claim friend.,7.0
5ad9494a-4e5d-450b-8c4b-5686ce65670e,0f840fe2-bf1e-4241-bf7d-3876e83f9fb4,2026-02-02 16:33:14.145091,Physical evidence region product knowledge.,5.0
9c2bdf97-0e70-403f-8919-3f749fa6d132,0f840fe2-bf1e-4241-bf7d-3876e83f9fb4,2026-02-14 15:32:58.145091,Second skill have police people kid available family him he call hospital white lot example question truth.,17.0
48e99e0d-9a2c-448d-8fd4-c3328bd64059,0f840fe2-bf1e-4241-bf7d-3876e83f9fb4,2026-02-19 21:23:14.145091,Relationship benefit family call within necessary foreign arm care project line stage.,12.0
92ccfffb-3358-45ee-80eb-ebaf7a442bd0,0f840fe2-bf1e-4241-bf7d-3876e83f9fb4,2026-02-09 13:16:57.145091,Bad vote current serve poor hot value month.,8.0
ace9111b-88c2-4cca-b540-2aee677fe272,0f840fe2-bf1e-4241-bf7d-3876e83f9fb4,2026-02-22 21:14:08.145091,Though purpose water same child standard trouble look listen same have partner strategy benefit.,14.0
29c8691b-2440-4efa-bee0-d30333ed0d44,0f840fe2-bf1e-4241-bf7d-3876e83f9fb4,2026-01-30 18:20:23.145091,Nature live tonight system school thus firm say friend up.,10.0
